,index,Discussion_translated,label_Automotive,label_Automotive>Auto Body Styles,label_Automotive>Auto Body Styles>Off-Road Vehicles,label_Automotive>Auto Body Styles>SUV,label_Automotive>Auto Body Styles>Sedan,label_Automotive>Auto Body Styles>Van,label_Automotive>Auto Buying and Selling,label_Automotive>Auto Insurance,label_Automotive>Auto Parts,label_Automotive>Auto Rentals,label_Automotive>Auto Repair,label_Automotive>Auto Safety,label_Automotive>Auto Shows,label_Automotive>Auto Technology,label_Automotive>Auto Type>Classic Cars,label_Automotive>Auto Type>Driverless Cars,label_Automotive>Auto Type>Green Vehicles,label_Automotive>Car Culture,label_Automotive>Motorcycles,label_Automotive>Scooters,label_Books and Literature,label_Books and Literature>Art and Photography Books,label_Books and Literature>Children's Literature,label_Books and Literature>Poetry,label_Books and Literature>Travel Books,label_Business And Finance>Business>Consumer Issues>Recalls,label_Business And Finance>Business>Executive Leadership & Management,label_Business And Finance>Business>Government Business,label_Business And Finance>Business>Green Solutions,label_Business and Finance,label_Business and Finance>Business,label_Business and Finance>Business>Business Accounting & Finance,label_Business and Finance>Business>Business Administration,label_Business and Finance>Business>Business Banking & Finance>Angel Investment,label_Business and Finance>Business>Business Banking & Finance>Bankruptcy,label_Business and Finance>Business>Business Operations,label_Business and Finance>Business>Human Resources,label_Business and Finance>Business>Large Business,label_Business and Finance>Business>Logistics,label_Business and Finance>Business>Marketing and Advertising,label_Business and Finance>Business>Sales,label_Business and Finance>Business>Startups,label_Business and Finance>Economy>Commodities,label_Business and Finance>Economy>Currencies,label_Business and Finance>Economy>Housing Market,label_Business and Finance>Industries,label_Business and Finance>Industries>Advertising Industry,label_Business and Finance>Industries>Agriculture,label_Business and Finance>Industries>Apparel Industry,label_Business and Finance>Industries>Automotive Industry,label_Business and Finance>Industries>Aviation Industry,label_Business and Finance>Industries>Biotech and Biomedical Industry,label_Business and Finance>Industries>Civil Engineering Industry,label_Business and Finance>Industries>Construction Industry,label_Business and Finance>Industries>Defense Industry,label_Business and Finance>Industries>Education industry,label_Business and Finance>Industries>Entertainment Industry,label_Business and Finance>Industries>Financial Industry,label_Business and Finance>Industries>Food Industry,label_Business and Finance>Industries>Healthcare Industry,label_Business and Finance>Industries>Hospitality Industry,label_Business and Finance>Industries>Legal Services Industry,label_Business and Finance>Industries>Logistics and Transportation Industry,label_Business and Finance>Industries>Management Consulting Industry,label_Business and Finance>Industries>Manufacturing Industry,label_Business and Finance>Industries>Mechanical and Industrial Engineering Industry,label_Business and Finance>Industries>Media Industry,label_Business and Finance>Industries>Pharmaceutical Industry,label_Business and Finance>Industries>Power and Energy Industry,label_Business and Finance>Industries>Publishing Industry,label_Business and Finance>Industries>Retail Industry,label_Business and Finance>Industries>Technology Industry,label_Business and Finance>Industries>Telecommunications Industry,label_Careers,label_Careers>Apprenticeships,label_Careers>Career Planning,label_Careers>Job Search,label_Education,label_Education>College Education,label_Education>College Education>Postgraduate Education,label_Education>College Education>Postgraduate Education>Professional School,label_Education>Early Childhood Education,label_Education>Educational Assessment>Standardized Testing,label_Education>Homeschooling,label_Education>Homework and Study,label_Education>Language Learning,label_Education>Primary Education,label_Education>Private School,label_Education>Secondary Education,label_Events and Attractions,label_Events and Attractions>Amusement and Theme Parks,label_Events and Attractions>Bars & Restaurants,label_Events and Attractions>Business Expos & Conferences,label_Events and Attractions>Casinos & Gambling,label_Events and Attractions>Cinemas and Events,label_Events and Attractions>Concerts & Music Events,label_Events and Attractions>Malls & Shopping Centers,label_Events and Attractions>Museums & Galleries,label_Events and Attractions>Musicals,label_Events and Attractions>National & Civic Holidays,label_Events and Attractions>Nightclubs,label_Events and Attractions>Outdoor Activities,label_Events and Attractions>Personal Celebrations and Life Events>Anniversary,label_Events and Attractions>Personal Celebrations and Life Events>Birthday,label_Events and Attractions>Personal Celebrations and Life Events>Funeral,label_Events and Attractions>Personal Celebrations and Life Events>Graduation,label_Events and Attractions>Personal Celebrations and Life Events>Prom,label_Events and Attractions>Personal Celebrations and Life Events>Wedding,label_Events and Attractions>Political Event,label_Events and Attractions>Sporting Events,label_Events and Attractions>Theater Venues and Events,label_Events and Attractions>Zoos & Aquariums,label_Family and Relationships,label_Family and Relationships>Dating,label_Family and Relationships>Marriage and Civil Unions,label_Family and Relationships>Parenting,label_Family and Relationships>Parenting>Adoption and Fostering,label_Family and Relationships>Parenting>Daycare and Pre-School,label_Family and Relationships>Parenting>Parenting Babies and Toddlers,label_Family and Relationships>Parenting>Parenting Children Aged 4-11,label_Family and Relationships>Single Life,label_Fine Art,label_Fine Art>Dance,label_Fine Art>Fine Art Photography,label_Fine Art>Modern Art,label_Fine Art>Opera,label_Fine Art>Theater,label_Food & Drink,label_Food & Drink>Alcoholic Beverages,label_Food & Drink>Barbecues and Grilling,label_Food & Drink>Cooking,label_Food & Drink>Desserts and Baking,label_Food & Drink>Dining Out,label_Food & Drink>Healthy Cooking and Eating,label_Food & Drink>Non-Alcoholic Beverages,label_Food & Drink>Vegetarian Diets,label_Food & Drink>World Cuisines,label_Healthy Living,label_Healthy Living>Children's Health,label_Healthy Living>Fitness and Exercise,label_Healthy Living>Fitness and Exercise>Running and Jogging,label_Healthy Living>Nutrition,label_Healthy Living>Weight Loss,label_Healthy Living>Wellness,label_Healthy Living>Women's Health,label_Hobbies & Interests,label_Hobbies & Interests>Antiquing and Antiques,label_Hobbies & Interests>Arts and Crafts,label_Hobbies & Interests>Arts and Crafts>Drawing and Sketching,label_Hobbies & Interests>Arts and Crafts>Needlework,label_Hobbies & Interests>Arts and Crafts>Painting,label_Hobbies & Interests>Arts and Crafts>Photography,label_Hobbies & Interests>Arts and Crafts>Scrapbooking,label_Hobbies & Interests>Arts and Crafts>Woodworking,label_Hobbies & Interests>Birdwatching,label_Hobbies & Interests>Cigars,label_Hobbies & Interests>Collecting,label_Hobbies & Interests>Content Production>Video Production,label_Hobbies & Interests>Games and Puzzles,label_Hobbies & Interests>Games and Puzzles>Board Games and Puzzles,label_Hobbies & Interests>Games and Puzzles>Card Games,label_Hobbies & Interests>Games and Puzzles>Roleplaying Games,label_Hobbies & Interests>Genealogy and Ancestry,label_Hobbies & Interests>Musical Instruments,label_Hobbies & Interests>Radio Control,label_Hobbies & Interests>Sci-fi and Fantasy,label_Hobbies & Interests>Workshops and Classes,label_Home & Garden,label_Home & Garden>Gardening,label_Home & Garden>Home Appliances,label_Home & Garden>Home Entertaining,label_Home & Garden>Home Improvement,label_Home & Garden>Interior Decorating,label_Home & Garden>Landscaping,label_Medical Health,label_Medical Health>Diseases and Conditions,label_Medical Health>Diseases and Conditions>Allergies,label_Medical Health>Diseases and Conditions>Blood Disorders,label_Medical Health>Diseases and Conditions>Brain and Nervous System Disorders,label_Medical Health>Diseases and Conditions>Cancer,label_Medical Health>Diseases and Conditions>Cold and Flu,label_Medical Health>Diseases and Conditions>Dental Health,label_Medical Health>Diseases and Conditions>Digestive Disorders,label_Medical Health>Diseases and Conditions>Infectious Diseases,label_Medical Health>Diseases and Conditions>Injuries,label_Medical Health>Diseases and Conditions>Injuries>First Aid,label_Medical Health>Diseases and Conditions>Lung and Respiratory Health,label_Medical Health>Diseases and Conditions>Mental Health,label_Medical Health>Diseases and Conditions>Reproductive Health,label_Medical Health>Diseases and Conditions>Sexual Health,label_Medical Health>Diseases and Conditions>Sleep Disorders,label_Medical Health>Pharmaceutical Drugs,label_Medical Health>Surgery,label_Medical Health>Vaccines,label_Movies,label_Movies>World Movies,label_Music and Audio,label_Music and Audio>Children's Music,label_Music and Audio>Classical Music,label_Music and Audio>Dance and Electronic Music,label_Music and Audio>World/International Music,label_News and Politics,label_News and Politics>Crime,label_News and Politics>Disasters,label_News and Politics>International News,label_News and Politics>Law,label_News and Politics>Local News,label_News and Politics>National News,label_News and Politics>Politics,label_News and Politics>Politics>Elections,label_News and Politics>Politics>Political Issues,label_News and Politics>Politics>War and Conflicts,label_News and Politics>Weather,label_Personal Finance>Financial Assistance>Government Support and Welfare,label_Personal Finance>Home Utilities>Water Services,label_Personal Finance>Insurance,label_Personal Finance>Insurance>Health Insurance,label_Personal Finance>Insurance>Motor Insurance,label_Personal Finance>Insurance>Travel Insurance,label_Personal Finance>Personal Debt,label_Personal Finance>Personal Debt>Credit Cards,label_Personal Finance>Personal Debt>Home Financing,label_Personal Finance>Personal Investing,label_Personal Finance>Personal Investing>Hedge Funds,label_Pets,label_Pets>Cats,label_Pets>Dogs,label_Pets>Large Animals,label_Pets>Pet Supplies,label_Pets>Reptiles,label_Pets>Veterinary Medicine,label_Pop Culture,label_Pop Culture>Celebrity Families,label_Pop Culture>Celebrity Scandal,label_Real Estate,label_Real Estate>Apartments,label_Real Estate>Developmental Sites,label_Real Estate>Land and Farms,label_Real Estate>Real Estate Buying and Selling,label_Religion & Spirituality,label_Religion & Spirituality>Buddhism,label_Religion & Spirituality>Christianity,label_Religion & Spirituality>Hinduism,label_Religion & Spirituality>Islam,label_Religion & Spirituality>Judaism,label_Science,label_Science>Biological Sciences,label_Science>Chemistry,label_Science>Environment,label_Science>Genetics,label_Science>Geography,label_Science>Geology,label_Science>Physics,label_Science>Space and Astronomy,label_Shopping,label_Shopping>Coupons and Discounts,label_Shopping>Flower Shopping,label_Shopping>Gifts and Greetings Cards,label_Shopping>Grocery Shopping,label_Shopping>Holiday Shopping,label_Shopping>Sales and Promotions,label_Sports,label_Sports>Auto Racing,label_Sports>Badminton,label_Sports>Basketball,label_Sports>Bodybuilding,label_Sports>Bowling,label_Sports>Boxing,label_Sports>College Sports,label_Sports>Cycling,label_Sports>Diving,label_Sports>Equine Sports,label_Sports>Equine Sports>Horse Racing,label_Sports>Extreme Sports>Canoeing and Kayaking,label_Sports>Extreme Sports>Climbing,label_Sports>Extreme Sports>Scuba Diving,label_Sports>Extreme Sports>Skateboarding,label_Sports>Extreme Sports>Surfing and Bodyboarding,label_Sports>Extreme Sports>Waterskiing and Wakeboarding,label_Sports>Figure Skating,label_Sports>Fishing Sports,label_Sports>Golf,label_Sports>Gymnastics,label_Sports>Hunting and Shooting,label_Sports>Ice Hockey,label_Sports>Martial Arts,label_Sports>Olympic Sports,label_Sports>Poker and Professional Gambling,label_Sports>Rowing,label_Sports>Skiing,label_Sports>Soccer,label_Sports>Swimming,label_Sports>Table Tennis,label_Sports>Tennis,label_Sports>Track and Field,label_Sports>Volleyball,label_Style & Fashion,label_Style & Fashion>Beauty,label_Style & Fashion>Beauty>Hair Care,label_Style & Fashion>Beauty>Makeup and Accessories,label_Style & Fashion>Beauty>Natural and Organic Beauty,label_Style & Fashion>Beauty>Perfume and Fragrance,label_Style & Fashion>Beauty>Skin Care,label_Style & Fashion>Designer Clothing,label_Style & Fashion>High Fashion,label_Style & Fashion>Men's Fashion>Men's Accessories,label_Style & Fashion>Men's Fashion>Men's Accessories>Men's Jewellery and Watches,label_Style & Fashion>Men's Fashion>Men's Clothing,label_Style & Fashion>Personal Care>Bath and Shower,label_Style & Fashion>Personal Care>Shaving,label_Style & Fashion>Women's Fashion,label_Style & Fashion>Women's Fashion>Women's Accessories,label_Style & Fashion>Women's Fashion>Women's Accessories>Women's Jewellery and Watches,label_Style & Fashion>Women's Fashion>Women's Clothing>Women's Intimates and Sleepwear,label_Technology & Computing,label_Technology & Computing>Artificial Intelligence,label_Technology & Computing>Augmented Reality,label_Technology & Computing>Computing,label_Technology & Computing>Computing>Computer Peripherals,label_Technology & Computing>Computing>Computer Software and Applications>Browsers,label_Technology & Computing>Computing>Computer Software and Applications>Digital Audio,label_Technology & Computing>Computing>Computer Software and Applications>Operating Systems,label_Technology & Computing>Computing>Computer Software and Applications>Video Software,label_Technology & Computing>Computing>Computer Software and Applications>Web Conferencing,label_Technology & Computing>Computing>Desktops,label_Technology & Computing>Computing>Information and Network Security,label_Technology & Computing>Computing>Internet,label_Technology & Computing>Computing>Internet>Cloud Computing,label_Technology & Computing>Computing>Internet>Search,label_Technology & Computing>Computing>Internet>Social Networking,label_Technology & Computing>Computing>Programming Languages,label_Technology & Computing>Consumer Electronics,label_Technology & Computing>Consumer Electronics>Cameras and Camcorders,label_Technology & Computing>Consumer Electronics>Smartphones,label_Technology & Computing>Consumer Electronics>Tablets and E-readers,label_Technology & Computing>Robotics,label_Technology & Computing>Virtual Reality,label_Television,label_Television>Animation TV,label_Television>Drama TV,label_Television>Factual TV,label_Television>Music TV,label_Travel,label_Travel>Travel Accessories,label_Travel>Travel Locations,label_Travel>Travel Locations>Africa Travel,label_Travel>Travel Locations>Asia Travel,label_Travel>Travel Locations>Australia and Oceania Travel,label_Travel>Travel Locations>Europe Travel,label_Travel>Travel Locations>North America Travel,label_Travel>Travel Locations>Polar Travel,label_Travel>Travel Locations>South America Travel,label_Travel>Travel Preparation and Advice,label_Travel>Travel Type,label_Travel>Travel Type>Adventure Travel,label_Travel>Travel Type>Air Travel,label_Travel>Travel Type>Bed & Breakfasts,label_Travel>Travel Type>Budget Travel,label_Travel>Travel Type>Business Travel,label_Travel>Travel Type>Camping,label_Travel>Travel Type>Cruises,label_Travel>Travel Type>Day Trips,label_Travel>Travel Type>Family Travel,label_Travel>Travel Type>Honeymoons and Getaways,label_Travel>Travel Type>Hotels and Motels,label_Travel>Travel Type>Rail Travel,label_Travel>Travel Type>Road Trips,label_Travel>Travel Type>Spas,label_Video Gaming,label_Video Gaming>Video Game Genres>Adventure Video Games,label_Video Gaming>Video Game Genres>Casual Games,label_Video Gaming>Video Game Genres>MMOs,label_Video Gaming>Video Game Genres>Role-Playing Video Games,relevance,Source_URL,Country,User_loc,Translated_discussion,Discussion_cleaned
0,70,"Tourists in a day, there is a half-side mountain, Haidi City, Shipu Seafood, and a day's trip is a bit rush, it is quite suitable for the young camping ?? Look at the sunrise, girlfriends, parent-child tour!
 http: t.cn/aigl393f???",0,0.0,0,0,0.0,0.0,0,0.0,0,0,0.0,0.0,0.0,0.0,0,0,0.0,0,0,0.0,0,0.0,0,0,0,0,0.0,0.0,0.0,0,0,0,0,0.0,0,0.0,0,0.0,0,0,0,0.0,0,0,0.0,0,0.0,0,0,0,0,0.0,0,0,0.0,0,0,0.0,0,0.0,0,0,0,0.0,0.0,0.0,0.0,0,0,0,0,0,0,0,0.0,0.0,0.0,0,0,0.0,0.0,0,0,0.0,0,0,0.0,0.0,0,0,0,0,0.0,0.0,0.0,0,0,0,0.0,0,0,0,0.0,0.0,0.0,0.0,0.0,0,0.0,0,0.0,0,0,0,0,0,0.0,0,0,0,0.0,0,0,0,0.0,0.0,0,0,0,0,0,0,0,0.0,0,0.0,0,0,0.0,0,0,0,0.0,0,0,0,0,0,0.0,0.0,0,0,0.0,0.0,0.0,0.0,0,0,0,0,0,0.0,0,0,0.0,0.0,0,0,0,0,0.0,0,0.0,0.0,0,0,0.0,0,0,0.0,0,0.0,0,0,0.0,0.0,0.0,0,0,0,0,0,0.0,0,0,0,0,0.0,0.0,0.0,0.0,0,0,0,0,0,0.0,0,0,0.0,0,0,0,0,0.0,0,0.0,0.0,0.0,0,0.0,0.0,0.0,0.0,0,0,0,0,0.0,0.0,0.0,0,0.0,0.0,0.0,0,0,0.0,0,0,0,0,0.0,0.0,0.0,0,0,0,0,0.0,0,0,0,0,0,0,0,0.0,0.0,0.0,0.0,0,0,0.0,0,0.0,0.0,0.0,0.0,0,0,0,0.0,0,0,0.0,0,0,0.0,0.0,0,0.0,0.0,0.0,0.0,0,0,0.0,0,0,0,0,0.0,0.0,0.0,0.0,0,0,0,0,0,0,0,0,0.0,0,0.0,0.0,0.0,0.0,0.0,0.0,0,0.0,0,0,0,0,0,0.0,0,0.0,0.0,0.0,0,0.0,0,0.0,0,0,0,0,0,0,0,0.0,0.0,0,0.0,0,0,0.0,0,0,0,0,0,0,0,0,0.0,0.0,0,0,0.0,0,0.0,0,0,100,0.0,0.0,0,0,0,0,0,0.0,0,0.0,0.0,0.0,0.0,10000,http://weibo.com/1589360301/KfGPxbH1b,CN,CN,"tourists in a day, there is a half-side mountain, haidi city, shipu seafood, and a day's trip is a bit rush, it is quite suitable for the young camping ?? look at the sunrise, girlfriends, parent-child tour!
 http: t.cn/aigl393f???","['tourists', 'day', 'half', 'side', 'mountain', 'haidi', 'city', 'shipu', 'seafood', 'days', 'trip', 'rush', 'quite', 'suitable', 'young', 'camp', 'sunrise', 'girlfriends', 'parent', 'child', 'tour', 'aigl393f']"
1,152,"Turkey 12 days free Raiders This way really has too many adventures. P2-P4 Istanbul P5-P8 Capado, P9, P5-P8, P2-P4, P5-P8, P2-P4, P9, Alacattanbul? Author: guojingnij # Turkey Travel ## Turkish Tour
 Raiders #?",0,0.0,0,0,0.0,0.0,0,0.0,0,0,0.0,0.0,0.0,0.0,0,0,0.0,0,0,0.0,0,0.0,0,0,0,0,0.0,0.0,0.0,0,0,0,0,0.0,0,0.0,0,0.0,0,0,0,0.0,0,0,0.0,0,0.0,0,0,0,0,0.0,0,0,0.0,0,0,0.0,0,0.0,0,0,0,0.0,0.0,0.0,0.0,0,0,100,0,0,0,0,0.0,0.0,0.0,0,0,0.0,0.0,0,0,0.0,0,0,0.0,0.0,0,0,0,0,0.0,0.0,0.0,0,0,0,0.0,0,0,0,0.0,0.0,0.0,0.0,0.0,0,0.0,0,0.0,0,0,0,0,0,0.0,0,0,0,0.0,0,0,0,0.0,0.0,0,0,0,0,0,0,0,0.0,0,0.0,0,0,0.0,0,0,0,0.0,0,0,0,0,0,0.0,0.0,0,0,0.0,0.0,0.0,0.0,0,0,0,0,0,0.0,0,0,0.0,0.0,0,0,0,0,0.0,0,0.0,0.0,0,0,0.0,0,0,0.0,0,0.0,0,0,0.0,0.0,0.0,0,0,0,0,0,0.0,0,0,0,0,0.0,0.0,0.0,0.0,0,0,0,0,0,0.0,0,0,0.0,0,0,0,0,0.0,0,0.0,0.0,0.0,0,0.0,0.0,0.0,0.0,0,0,0,0,0.0,0.0,0.0,0,0.0,0.0,0.0,0,0,0.0,0,0,0,0,0.0,0.0,0.0,0,0,0,0,0.0,0,0,0,0,0,0,0,0.0,0.0,0.0,0.0,0,0,0.0,0,0.0,0.0,0.0,0.0,0,0,0,0.0,0,0,0.0,0,0,0.0,0.0,0,0.0,0.0,0.0,0.0,0,0,0.0,0,0,0,0,0.0,0.0,0.0,0.0,0,0,0,0,0,0,0,0,0.0,0,0.0,0.0,0.0,0.0,0.0,0.0,0,0.0,0,0,0,0,0,0.0,0,0.0,0.0,0.0,0,0.0,0,0.0,0,0,0,0,0,0,0,0.0,0.0,0,0.0,0,0,0.0,0,0,0,0,100,0,100,100,0.0,0.0,0,0,100.0,0,0.0,0,0,0,0.0,0.0,0,0,0,0,0,0.0,0,0.0,0.0,0.0,0.0,50000,http://weibo.com/2137741580/JFLD7lj7M,CN,CN,"turkey 12 days free raiders this way really has too many adventures. p2-p4 istanbul p5-p8 capado, p9, p5-p8, p2-p4, p5-p8, p2-p4, p9, alacattanbul? author: guojingnij # turkey travel ## turkish tour
 raiders #?","['turkey', '12', 'days', 'free', 'way', 'many', 'adventure', 'p2', 'p4', 'istanbul', 'p5', 'p8', 'capado', 'p9', 'p5', 'p8', 'p2', 'p4', 'p5', 'p8', 'p2', 'p4', 'p9', 'alacattanbul', 'author', 'guojingnij', 'turkey', 'travel', 'turkish', 'tour']"
2,161,"Today, you can teach you ski circles ~ # 雪 谷 ## 滨 旅游游 # ## 雪乡 # 哈尔滨 中国 中国 中国 手 手 微 微 视频 视频 视频 视频 视频 视频",0,0.0,0,0,0.0,0.0,0,0.0,0,0,0.0,0.0,0.0,0.0,0,0,0.0,0,0,0.0,0,0.0,0,0,0,0,0.0,0.0,0.0,0,0,0,0,0.0,0,0.0,0,0.0,0,0,0,0.0,0,0,0.0,0,0.0,0,0,0,0,0.0,0,0,0.0,0,0,0.0,0,0.0,0,0,0,0.0,0.0,0.0,0.0,0,0,0,0,0,0,0,0.0,0.0,0.0,0,0,0.0,0.0,0,0,0.0,0,0,0.0,0.0,0,0,0,0,0.0,0.0,0.0,0,0,0,0.0,0,0,0,0.0,0.0,0.0,0.0,0.0,0,0.0,0,0.0,0,0,0,0,0,0.0,0,0,0,0.0,0,0,0,0.0,0.0,0,0,0,0,0,0,0,0.0,0,0.0,0,0,0.0,0,0,0,0.0,0,0,0,0,0,0.0,0.0,0,0,0.0,0.0,0.0,0.0,0,0,0,0,0,0.0,0,0,0.0,0.0,0,0,0,0,0.0,0,0.0,0.0,0,0,0.0,0,0,0.0,0,0.0,0,0,0.0,0.0,0.0,0,0,0,0,0,0.0,0,0,0,0,0.0,0.0,0.0,0.0,0,0,0,0,0,0.0,0,0,0.0,0,0,0,0,0.0,0,0.0,0.0,0.0,0,0.0,0.0,0.0,0.0,0,0,0,0,0.0,0.0,0.0,0,0.0,0.0,0.0,0,0,0.0,0,0,0,0,0.0,0.0,0.0,0,0,0,0,0.0,0,0,0,0,0,0,0,0.0,0.0,0.0,0.0,0,0,0.0,0,0.0,0.0,0.0,0.0,0,0,0,0.0,0,0,0.0,0,0,0.0,0.0,0,0.0,0.0,0.0,0.0,0,0,0.0,0,100,0,0,0.0,0.0,0.0,0.0,0,0,0,0,0,0,0,0,0.0,0,0.0,0.0,0.0,0.0,0.0,0.0,0,0.0,0,0,0,0,0,0.0,0,0.0,0.0,0.0,0,0.0,0,0.0,0,0,0,0,0,0,0,0.0,0.0,0,0.0,0,0,0.0,0,0,0,0,0,0,0,0,0.0,0.0,0,0,0.0,0,0.0,0,0,0,0.0,0.0,0,0,0,0,0,0.0,0,0.0,0.0,0.0,0.0,10000,http://weibo.com/5465685492/JCFBtmfia,CN,CN,"today, you can teach you ski circles ~ # 雪 谷 ## 滨 旅游游 # ## 雪乡 # 哈尔滨 中国 中国 中国 手 手 微 微 视频 视频 视频 视频 视频 视频","['today', 'teach', 'ski', 'circle', '雪', '谷', '滨', '雪乡', '哈尔滨', '手', '手']"
3,231,"Chengdu surrounding day swimming in the summer, the water, the city, recommended # 成都 旅游游 # ## 西 旅游 旅游游 # ## 成都 营 ## 旅游 推 推 ## 成都 周游 ## 西 旅游游 ## 西 旅行 # [Chengdu] (http: //
 T.cn/r2wxuoh) [Microfaway Video] (http://t.cn/a6fpryxo) ???",0,0.0,0,0,0.0,0.0,0,0.0,0,0,0.0,0.0,0.0,0.0,0,0,0.0,0,0,0.0,0,0.0,0,0,0,0,0.0,0.0,0.0,0,0,0,0,0.0,0,0.0,0,0.0,0,0,0,0.0,0,0,0.0,0,0.0,0,0,0,0,0.0,0,0,0.0,0,0,0.0,0,0.0,0,0,0,0.0,0.0,0.0,0.0,0,0,0,0,0,0,0,0.0,0.0,0.0,0,0,0.0,0.0,0,0,0.0,0,0,0.0,0.0,0,0,0,0,0.0,0.0,0.0,0,0,0,0.0,0,0,0,0.0,0.0,0.0,0.0,0.0,0,0.0,0,0.0,0,0,0,0,0,0.0,0,0,0,0.0,0,0,0,0.0,0.0,0,0,0,0,0,0,0,0.0,0,0.0,0,0,0.0,0,0,0,0.0,0,0,0,0,0,0.0,0.0,0,0,0.0,0.0,0.0,0.0,0,0,0,0,0,0.0,0,0,0.0,0.0,0,0,0,0,0.0,0,0.0,0.0,0,0,0.0,0,0,0.0,0,0.0,0,0,0.0,0.0,0.0,0,0,0,0,0,0.0,0,0,0,0,0.0,0.0,0.0,0.0,0,0,0,0,0,0.0,0,0,0.0,0,0,0,0,0.0,0,0.0,0.0,0.0,0,0.0,0.0,0.0,0.0,0,0,0,0,0.0,0.0,0.0,0,0.0,0.0,0.0,0,0,0.0,0,0,0,0,0.0,0.0,0.0,0,0,0,0,0.0,0,0,0,0,0,0,0,0.0,0.0,0.0,0.0,0,0,0.0,0,0.0,0.0,0.0,0.0,0,0,0,0.0,0,0,0.0,0,0,0.0,0.0,0,0.0,0.0,0.0,0.0,0,0,0.0,0,0,0,100,0.0,0.0,0.0,0.0,0,0,0,0,0,0,0,0,0.0,0,0.0,0.0,0.0,0.0,0.0,0.0,0,0.0,0,0,0,0,0,0.0,0,0.0,0.0,0.0,0,0.0,0,0.0,0,0,0,0,0,0,0,0.0,0.0,0,0.0,0,0,0.0,0,0,0,0,0,0,0,0,0.0,0.0,0,0,0.0,0,0.0,0,0,0,0.0,0.0,0,0,0,0,0,0.0,0,0.0,0.0,0.0,0.0,10000,http://weibo.com/3181174844/KoqwOcwn2,CN,CN,"chengdu surrounding day swimming in the summer, the water, the city, recommended # 成都 旅游游 # ## 西 旅游 旅游游 # ## 成都 营 ## 旅游 推 推 ## 成都 周游 ## 西 旅游游 ## 西 旅行 # [chengdu] (http: //
 t.cn/r2wxuoh) [microfaway video] (http://t.cn/a6fpryxo) ???","['chengdu', 'surround', 'day', 'swim', 'summer', 'water', 'city', 'recommend', '成都', '成都', '营', '成都', '周游', '旅行', 'chengdu', 'r2wxuoh', 'microfaway', 'video', 'a6fpryxo']"
4,236,"# 云 享 时间 - 2 years old ## 亲子 游 # # 不 情 情 情, ski equipment is ready, homes",0,0.0,0,0,0.0,0.0,0,0.0,0,0,0.0,0.0,0.0,0.0,0,0,0.0,0,0,0.0,0,0.0,0,0,0,0,0.0,0.0,0.0,0,0,0,0,0.0,0,0.0,0,0.0,0,0,0,0.0,0,0,0.0,0,0.0,0,0,0,0,0.0,0,0,0.0,0,0,0.0,0,0.0,0,0,0,0.0,0.0,0.0,0.0,0,0,0,0,0,0,0,0.0,0.0,0.0,0,0,0.0,0.0,0,0,0.0,0,0,0.0,0.0,0,0,0,0,0.0,0.0,0.0,0,0,0,0.0,0,0,0,0.0,0.0,0.0,0.0,0.0,0,0.0,0,0.0,0,0,0,0,0,0.0,0,0,0,0.0,0,0,0,0.0,0.0,0,0,0,0,0,0,0,0.0,0,0.0,0,0,0.0,0,0,0,0.0,0,0,0,0,0,0.0,0.0,0,0,0.0,0.0,0.0,0.0,0,0,0,0,0,0.0,0,0,0.0,0.0,0,0,0,0,0.0,0,0.0,0.0,0,0,0.0,0,0,0.0,0,0.0,0,0,0.0,0.0,0.0,0,0,0,0,0,0.0,0,0,0,0,0.0,0.0,0.0,0.0,0,0,0,0,0,0.0,0,0,0.0,0,0,0,0,0.0,0,0.0,0.0,0.0,0,0.0,0.0,0.0,0.0,0,0,0,0,0.0,0.0,0.0,0,0.0,0.0,0.0,0,0,0.0,0,0,0,0,0.0,0.0,0.0,0,0,0,0,0.0,0,0,0,0,0,0,0,0.0,0.0,0.0,0.0,0,0,0.0,0,0.0,0.0,0.0,0.0,0,0,0,0.0,0,0,0.0,0,0,0.0,0.0,0,0.0,0.0,0.0,0.0,0,0,0.0,0,100,0,0,0.0,0.0,0.0,0.0,0,0,0,0,0,0,0,0,0.0,0,0.0,0.0,0.0,0.0,0.0,0.0,0,0.0,0,0,0,0,0,0.0,0,0.0,0.0,0.0,0,0.0,0,0.0,0,0,0,0,0,0,0,0.0,0.0,0,0.0,0,0,0.0,0,0,0,0,0,0,0,0,0.0,0.0,0,0,0.0,0,0.0,0,0,0,0.0,0.0,0,0,0,0,0,0.0,0,0.0,0.0,0.0,0.0,10000,http://weibo.com/2499409425/JDSswsasl,CN,CN,"# 云 享 时间 - 2 years old ## 亲子 游 # # 不 情 情 情, ski equipment is ready, homes","['享', '时间', '2', 'old', '亲子', '情', '情', '情', 'ski', 'equipment', 'ready', 'home']"
