,index,Discussion_translated,label_Automotive,label_Automotive>Auto Body Styles,label_Automotive>Auto Body Styles>Off-Road Vehicles,label_Automotive>Auto Body Styles>SUV,label_Automotive>Auto Body Styles>Sedan,label_Automotive>Auto Body Styles>Van,label_Automotive>Auto Buying and Selling,label_Automotive>Auto Insurance,label_Automotive>Auto Parts,label_Automotive>Auto Rentals,label_Automotive>Auto Repair,label_Automotive>Auto Safety,label_Automotive>Auto Shows,label_Automotive>Auto Technology,label_Automotive>Auto Type>Classic Cars,label_Automotive>Auto Type>Driverless Cars,label_Automotive>Auto Type>Green Vehicles,label_Automotive>Car Culture,label_Automotive>Motorcycles,label_Automotive>Scooters,label_Books and Literature,label_Books and Literature>Art and Photography Books,label_Books and Literature>Children's Literature,label_Books and Literature>Poetry,label_Books and Literature>Travel Books,label_Business And Finance>Business>Consumer Issues>Recalls,label_Business And Finance>Business>Executive Leadership & Management,label_Business And Finance>Business>Government Business,label_Business And Finance>Business>Green Solutions,label_Business and Finance,label_Business and Finance>Business,label_Business and Finance>Business>Business Accounting & Finance,label_Business and Finance>Business>Business Administration,label_Business and Finance>Business>Business Banking & Finance>Angel Investment,label_Business and Finance>Business>Business Banking & Finance>Bankruptcy,label_Business and Finance>Business>Business Operations,label_Business and Finance>Business>Human Resources,label_Business and Finance>Business>Large Business,label_Business and Finance>Business>Logistics,label_Business and Finance>Business>Marketing and Advertising,label_Business and Finance>Business>Sales,label_Business and Finance>Business>Startups,label_Business and Finance>Economy>Commodities,label_Business and Finance>Economy>Currencies,label_Business and Finance>Economy>Housing Market,label_Business and Finance>Industries,label_Business and Finance>Industries>Advertising Industry,label_Business and Finance>Industries>Agriculture,label_Business and Finance>Industries>Apparel Industry,label_Business and Finance>Industries>Automotive Industry,label_Business and Finance>Industries>Aviation Industry,label_Business and Finance>Industries>Biotech and Biomedical Industry,label_Business and Finance>Industries>Civil Engineering Industry,label_Business and Finance>Industries>Construction Industry,label_Business and Finance>Industries>Defense Industry,label_Business and Finance>Industries>Education industry,label_Business and Finance>Industries>Entertainment Industry,label_Business and Finance>Industries>Financial Industry,label_Business and Finance>Industries>Food Industry,label_Business and Finance>Industries>Healthcare Industry,label_Business and Finance>Industries>Hospitality Industry,label_Business and Finance>Industries>Legal Services Industry,label_Business and Finance>Industries>Logistics and Transportation Industry,label_Business and Finance>Industries>Management Consulting Industry,label_Business and Finance>Industries>Manufacturing Industry,label_Business and Finance>Industries>Mechanical and Industrial Engineering Industry,label_Business and Finance>Industries>Media Industry,label_Business and Finance>Industries>Pharmaceutical Industry,label_Business and Finance>Industries>Power and Energy Industry,label_Business and Finance>Industries>Publishing Industry,label_Business and Finance>Industries>Retail Industry,label_Business and Finance>Industries>Technology Industry,label_Business and Finance>Industries>Telecommunications Industry,label_Careers,label_Careers>Apprenticeships,label_Careers>Career Planning,label_Careers>Job Search,label_Education,label_Education>College Education,label_Education>College Education>Postgraduate Education,label_Education>College Education>Postgraduate Education>Professional School,label_Education>Early Childhood Education,label_Education>Educational Assessment>Standardized Testing,label_Education>Homeschooling,label_Education>Homework and Study,label_Education>Language Learning,label_Education>Primary Education,label_Education>Private School,label_Education>Secondary Education,label_Events and Attractions,label_Events and Attractions>Amusement and Theme Parks,label_Events and Attractions>Bars & Restaurants,label_Events and Attractions>Business Expos & Conferences,label_Events and Attractions>Casinos & Gambling,label_Events and Attractions>Cinemas and Events,label_Events and Attractions>Concerts & Music Events,label_Events and Attractions>Malls & Shopping Centers,label_Events and Attractions>Museums & Galleries,label_Events and Attractions>Musicals,label_Events and Attractions>National & Civic Holidays,label_Events and Attractions>Nightclubs,label_Events and Attractions>Outdoor Activities,label_Events and Attractions>Personal Celebrations and Life Events>Anniversary,label_Events and Attractions>Personal Celebrations and Life Events>Birthday,label_Events and Attractions>Personal Celebrations and Life Events>Funeral,label_Events and Attractions>Personal Celebrations and Life Events>Graduation,label_Events and Attractions>Personal Celebrations and Life Events>Prom,label_Events and Attractions>Personal Celebrations and Life Events>Wedding,label_Events and Attractions>Political Event,label_Events and Attractions>Sporting Events,label_Events and Attractions>Theater Venues and Events,label_Events and Attractions>Zoos & Aquariums,label_Family and Relationships,label_Family and Relationships>Dating,label_Family and Relationships>Marriage and Civil Unions,label_Family and Relationships>Parenting,label_Family and Relationships>Parenting>Adoption and Fostering,label_Family and Relationships>Parenting>Daycare and Pre-School,label_Family and Relationships>Parenting>Parenting Babies and Toddlers,label_Family and Relationships>Parenting>Parenting Children Aged 4-11,label_Family and Relationships>Single Life,label_Fine Art,label_Fine Art>Dance,label_Fine Art>Fine Art Photography,label_Fine Art>Modern Art,label_Fine Art>Opera,label_Fine Art>Theater,label_Food & Drink,label_Food & Drink>Alcoholic Beverages,label_Food & Drink>Barbecues and Grilling,label_Food & Drink>Cooking,label_Food & Drink>Desserts and Baking,label_Food & Drink>Dining Out,label_Food & Drink>Healthy Cooking and Eating,label_Food & Drink>Non-Alcoholic Beverages,label_Food & Drink>Vegetarian Diets,label_Food & Drink>World Cuisines,label_Healthy Living,label_Healthy Living>Children's Health,label_Healthy Living>Fitness and Exercise,label_Healthy Living>Fitness and Exercise>Running and Jogging,label_Healthy Living>Nutrition,label_Healthy Living>Weight Loss,label_Healthy Living>Wellness,label_Healthy Living>Women's Health,label_Hobbies & Interests,label_Hobbies & Interests>Antiquing and Antiques,label_Hobbies & Interests>Arts and Crafts,label_Hobbies & Interests>Arts and Crafts>Drawing and Sketching,label_Hobbies & Interests>Arts and Crafts>Needlework,label_Hobbies & Interests>Arts and Crafts>Painting,label_Hobbies & Interests>Arts and Crafts>Photography,label_Hobbies & Interests>Arts and Crafts>Scrapbooking,label_Hobbies & Interests>Arts and Crafts>Woodworking,label_Hobbies & Interests>Birdwatching,label_Hobbies & Interests>Cigars,label_Hobbies & Interests>Collecting,label_Hobbies & Interests>Content Production>Video Production,label_Hobbies & Interests>Games and Puzzles,label_Hobbies & Interests>Games and Puzzles>Board Games and Puzzles,label_Hobbies & Interests>Games and Puzzles>Card Games,label_Hobbies & Interests>Games and Puzzles>Roleplaying Games,label_Hobbies & Interests>Genealogy and Ancestry,label_Hobbies & Interests>Musical Instruments,label_Hobbies & Interests>Radio Control,label_Hobbies & Interests>Sci-fi and Fantasy,label_Hobbies & Interests>Workshops and Classes,label_Home & Garden,label_Home & Garden>Gardening,label_Home & Garden>Home Appliances,label_Home & Garden>Home Entertaining,label_Home & Garden>Home Improvement,label_Home & Garden>Interior Decorating,label_Home & Garden>Landscaping,label_Medical Health,label_Medical Health>Diseases and Conditions,label_Medical Health>Diseases and Conditions>Allergies,label_Medical Health>Diseases and Conditions>Blood Disorders,label_Medical Health>Diseases and Conditions>Brain and Nervous System Disorders,label_Medical Health>Diseases and Conditions>Cancer,label_Medical Health>Diseases and Conditions>Cold and Flu,label_Medical Health>Diseases and Conditions>Dental Health,label_Medical Health>Diseases and Conditions>Digestive Disorders,label_Medical Health>Diseases and Conditions>Infectious Diseases,label_Medical Health>Diseases and Conditions>Injuries,label_Medical Health>Diseases and Conditions>Injuries>First Aid,label_Medical Health>Diseases and Conditions>Lung and Respiratory Health,label_Medical Health>Diseases and Conditions>Mental Health,label_Medical Health>Diseases and Conditions>Reproductive Health,label_Medical Health>Diseases and Conditions>Sexual Health,label_Medical Health>Diseases and Conditions>Sleep Disorders,label_Medical Health>Pharmaceutical Drugs,label_Medical Health>Surgery,label_Medical Health>Vaccines,label_Movies,label_Movies>World Movies,label_Music and Audio,label_Music and Audio>Children's Music,label_Music and Audio>Classical Music,label_Music and Audio>Dance and Electronic Music,label_Music and Audio>World/International Music,label_News and Politics,label_News and Politics>Crime,label_News and Politics>Disasters,label_News and Politics>International News,label_News and Politics>Law,label_News and Politics>Local News,label_News and Politics>National News,label_News and Politics>Politics,label_News and Politics>Politics>Elections,label_News and Politics>Politics>Political Issues,label_News and Politics>Politics>War and Conflicts,label_News and Politics>Weather,label_Personal Finance>Financial Assistance>Government Support and Welfare,label_Personal Finance>Home Utilities>Water Services,label_Personal Finance>Insurance,label_Personal Finance>Insurance>Health Insurance,label_Personal Finance>Insurance>Motor Insurance,label_Personal Finance>Insurance>Travel Insurance,label_Personal Finance>Personal Debt,label_Personal Finance>Personal Debt>Credit Cards,label_Personal Finance>Personal Debt>Home Financing,label_Personal Finance>Personal Investing,label_Personal Finance>Personal Investing>Hedge Funds,label_Pets,label_Pets>Cats,label_Pets>Dogs,label_Pets>Large Animals,label_Pets>Pet Supplies,label_Pets>Reptiles,label_Pets>Veterinary Medicine,label_Pop Culture,label_Pop Culture>Celebrity Families,label_Pop Culture>Celebrity Scandal,label_Real Estate,label_Real Estate>Apartments,label_Real Estate>Developmental Sites,label_Real Estate>Land and Farms,label_Real Estate>Real Estate Buying and Selling,label_Religion & Spirituality,label_Religion & Spirituality>Buddhism,label_Religion & Spirituality>Christianity,label_Religion & Spirituality>Hinduism,label_Religion & Spirituality>Islam,label_Religion & Spirituality>Judaism,label_Science,label_Science>Biological Sciences,label_Science>Chemistry,label_Science>Environment,label_Science>Genetics,label_Science>Geography,label_Science>Geology,label_Science>Physics,label_Science>Space and Astronomy,label_Shopping,label_Shopping>Coupons and Discounts,label_Shopping>Flower Shopping,label_Shopping>Gifts and Greetings Cards,label_Shopping>Grocery Shopping,label_Shopping>Holiday Shopping,label_Shopping>Sales and Promotions,label_Sports,label_Sports>Auto Racing,label_Sports>Badminton,label_Sports>Basketball,label_Sports>Bodybuilding,label_Sports>Bowling,label_Sports>Boxing,label_Sports>College Sports,label_Sports>Cycling,label_Sports>Diving,label_Sports>Equine Sports,label_Sports>Equine Sports>Horse Racing,label_Sports>Extreme Sports>Canoeing and Kayaking,label_Sports>Extreme Sports>Climbing,label_Sports>Extreme Sports>Scuba Diving,label_Sports>Extreme Sports>Skateboarding,label_Sports>Extreme Sports>Surfing and Bodyboarding,label_Sports>Extreme Sports>Waterskiing and Wakeboarding,label_Sports>Figure Skating,label_Sports>Fishing Sports,label_Sports>Golf,label_Sports>Gymnastics,label_Sports>Hunting and Shooting,label_Sports>Ice Hockey,label_Sports>Martial Arts,label_Sports>Olympic Sports,label_Sports>Poker and Professional Gambling,label_Sports>Rowing,label_Sports>Skiing,label_Sports>Soccer,label_Sports>Swimming,label_Sports>Table Tennis,label_Sports>Tennis,label_Sports>Track and Field,label_Sports>Volleyball,label_Style & Fashion,label_Style & Fashion>Beauty,label_Style & Fashion>Beauty>Hair Care,label_Style & Fashion>Beauty>Makeup and Accessories,label_Style & Fashion>Beauty>Natural and Organic Beauty,label_Style & Fashion>Beauty>Perfume and Fragrance,label_Style & Fashion>Beauty>Skin Care,label_Style & Fashion>Designer Clothing,label_Style & Fashion>High Fashion,label_Style & Fashion>Men's Fashion>Men's Accessories,label_Style & Fashion>Men's Fashion>Men's Accessories>Men's Jewellery and Watches,label_Style & Fashion>Men's Fashion>Men's Clothing,label_Style & Fashion>Personal Care>Bath and Shower,label_Style & Fashion>Personal Care>Shaving,label_Style & Fashion>Women's Fashion,label_Style & Fashion>Women's Fashion>Women's Accessories,label_Style & Fashion>Women's Fashion>Women's Accessories>Women's Jewellery and Watches,label_Style & Fashion>Women's Fashion>Women's Clothing>Women's Intimates and Sleepwear,label_Technology & Computing,label_Technology & Computing>Artificial Intelligence,label_Technology & Computing>Augmented Reality,label_Technology & Computing>Computing,label_Technology & Computing>Computing>Computer Peripherals,label_Technology & Computing>Computing>Computer Software and Applications>Browsers,label_Technology & Computing>Computing>Computer Software and Applications>Digital Audio,label_Technology & Computing>Computing>Computer Software and Applications>Operating Systems,label_Technology & Computing>Computing>Computer Software and Applications>Video Software,label_Technology & Computing>Computing>Computer Software and Applications>Web Conferencing,label_Technology & Computing>Computing>Desktops,label_Technology & Computing>Computing>Information and Network Security,label_Technology & Computing>Computing>Internet,label_Technology & Computing>Computing>Internet>Cloud Computing,label_Technology & Computing>Computing>Internet>Search,label_Technology & Computing>Computing>Internet>Social Networking,label_Technology & Computing>Computing>Programming Languages,label_Technology & Computing>Consumer Electronics,label_Technology & Computing>Consumer Electronics>Cameras and Camcorders,label_Technology & Computing>Consumer Electronics>Smartphones,label_Technology & Computing>Consumer Electronics>Tablets and E-readers,label_Technology & Computing>Robotics,label_Technology & Computing>Virtual Reality,label_Television,label_Television>Animation TV,label_Television>Drama TV,label_Television>Factual TV,label_Television>Music TV,label_Travel,label_Travel>Travel Accessories,label_Travel>Travel Locations,label_Travel>Travel Locations>Africa Travel,label_Travel>Travel Locations>Asia Travel,label_Travel>Travel Locations>Australia and Oceania Travel,label_Travel>Travel Locations>Europe Travel,label_Travel>Travel Locations>North America Travel,label_Travel>Travel Locations>Polar Travel,label_Travel>Travel Locations>South America Travel,label_Travel>Travel Preparation and Advice,label_Travel>Travel Type,label_Travel>Travel Type>Adventure Travel,label_Travel>Travel Type>Air Travel,label_Travel>Travel Type>Bed & Breakfasts,label_Travel>Travel Type>Budget Travel,label_Travel>Travel Type>Business Travel,label_Travel>Travel Type>Camping,label_Travel>Travel Type>Cruises,label_Travel>Travel Type>Day Trips,label_Travel>Travel Type>Family Travel,label_Travel>Travel Type>Honeymoons and Getaways,label_Travel>Travel Type>Hotels and Motels,label_Travel>Travel Type>Rail Travel,label_Travel>Travel Type>Road Trips,label_Travel>Travel Type>Spas,label_Video Gaming,label_Video Gaming>Video Game Genres>Adventure Video Games,label_Video Gaming>Video Game Genres>Casual Games,label_Video Gaming>Video Game Genres>MMOs,label_Video Gaming>Video Game Genres>Role-Playing Video Games,relevance,Source_URL,Country,User_loc,Translated_discussion,Discussion_cleaned
0,54,"Zhangjiajie Free Raiders Zhangjiajie travel a trip to the millennium!
 Once the world center.
 Looking back in Millennium, it is so beautiful and landscape, super detailed Zhangjiajie Tourism Raiders come to travel, Hunan is waiting for you!
 # 张家界 旅游游 ## 南 旅游游 ## 张家界 旅游游 #???",0,0.0,0,0,0.0,0.0,0,0.0,0,0,0.0,0.0,0.0,0.0,0,0,0.0,0,0,0.0,0,0.0,0,0,0,0,0.0,0.0,0.0,0,0,0,0,0.0,0,0.0,0,0.0,0,0,0,0.0,0,0,0.0,0,0.0,0,0,0,0,0.0,0,0,0.0,0,0,0.0,0,0.0,0,0,0,0.0,0.0,0.0,0.0,0,0,0,0,0,0,0,0.0,0.0,0.0,0,0,0.0,0.0,0,0,0.0,0,0,0.0,0.0,0,0,0,0,0.0,0.0,0.0,0,0,0,0.0,0,0,0,0.0,0.0,0.0,0.0,0.0,0,0.0,0,0.0,0,0,0,0,0,0.0,0,0,0,0.0,0,0,0,0.0,0.0,0,0,0,0,0,0,0,0.0,0,0.0,50,0,0.0,0,0,0,0.0,0,0,0,0,0,0.0,0.0,0,0,0.0,0.0,0.0,0.0,0,0,0,0,0,0.0,0,0,0.0,0.0,0,0,0,0,0.0,0,0.0,0.0,0,0,0.0,0,0,0.0,0,0.0,0,0,0.0,0.0,0.0,0,0,0,0,0,0.0,0,50,0,0,0.0,0.0,0.0,0.0,0,0,0,0,0,0.0,0,0,0.0,0,0,0,0,0.0,0,0.0,0.0,0.0,0,0.0,0.0,0.0,0.0,0,0,0,0,0.0,0.0,0.0,0,0.0,0.0,0.0,0,0,0.0,0,0,0,0,0.0,0.0,0.0,0,0,0,0,0.0,0,0,0,0,0,0,0,0.0,0.0,0.0,0.0,0,0,0.0,0,0.0,0.0,0.0,0.0,0,0,0,0.0,0,0,0.0,0,0,0.0,0.0,0,0.0,0.0,0.0,0.0,0,0,0.0,0,0,0,0,0.0,0.0,0.0,0.0,0,0,0,0,0,0,0,0,0.0,0,0.0,0.0,0.0,0.0,0.0,0.0,0,0.0,0,0,0,0,0,0.0,0,0.0,0.0,0.0,0,0.0,0,0.0,0,0,0,0,0,0,0,0.0,0.0,0,0.0,0,0,0.0,200,0,0,0,0,0,0,0,0.0,0.0,0,0,0.0,0,0.0,0,0,0,0.0,0.0,0,0,0,0,0,0.0,0,0.0,0.0,0.0,0.0,25000,http://weibo.com/2776474625/Kmh8xoT1q,CN,CN,"zhangjiajie free raiders zhangjiajie travel a trip to the millennium!
 once the world center.
 looking back in millennium, it is so beautiful and landscape, super detailed zhangjiajie tourism raiders come to travel, hunan is waiting for you!
 # 张家界 旅游游 ## 南 旅游游 ## 张家界 旅游游 #???","['zhangjiajie', 'free', 'zhangjiajie', 'travel', 'trip', 'millennium', 'world', 'center', 'millennium', 'beautiful', 'landscape', 'super', 'detail', 'zhangjiajie', 'tourism', 'travel', 'hunan', 'wait', '张家界', '张家界']"
1,56,"I saw 1, he had an infected new crown in the UK in April 2020, which is from South Korea in December. 4 detection in South Korea is a critical value, and I don't know that this test results are simulated or numbers.
 I didn't discuss it first, and he went 14 days + 1 night from South Korea. In Guangdong Province, it turned several cities: I think this kind of overseas staff should never have more time a few days? Then January 1st to Zhejiang
 Hangzhou, the epidemic is so serious, if it is back to work, how can I go shopping in Guangdong and then return to Zhejiang? I can't understand.",0,0.0,0,0,0.0,0.0,0,0.0,0,0,0.0,0.0,0.0,0.0,0,0,0.0,0,0,0.0,0,0.0,0,0,0,0,0.0,0.0,0.0,0,0,0,0,0.0,0,0.0,100,0.0,0,0,0,0.0,0,0,0.0,0,0.0,0,0,0,0,0.0,0,0,0.0,0,0,0.0,0,0.0,0,0,0,0.0,0.0,0.0,0.0,0,0,0,0,0,0,0,0.0,0.0,0.0,0,0,0.0,0.0,0,0,0.0,0,0,0.0,0.0,0,0,0,0,0.0,0.0,0.0,0,0,0,0.0,0,0,0,0.0,0.0,0.0,0.0,0.0,0,0.0,0,0.0,0,0,0,0,0,0.0,0,0,0,0.0,0,0,0,0.0,0.0,0,0,0,0,0,0,0,0.0,0,0.0,100,0,0.0,0,0,0,0.0,0,0,0,0,0,0.0,0.0,0,0,0.0,0.0,0.0,0.0,0,0,0,0,0,0.0,0,0,0.0,0.0,0,0,0,0,0.0,0,0.0,0.0,0,100,0.0,0,0,0.0,0,0.0,0,0,0.0,0.0,0.0,0,0,0,0,0,0.0,0,0,0,0,0.0,0.0,0.0,0.0,0,0,0,0,0,0.0,0,0,0.0,0,0,0,0,0.0,0,0.0,0.0,0.0,0,0.0,0.0,0.0,0.0,0,0,0,0,0.0,0.0,0.0,0,0.0,0.0,0.0,0,0,0.0,0,0,0,0,0.0,0.0,0.0,0,0,0,0,0.0,0,0,0,0,0,0,0,0.0,0.0,0.0,0.0,0,0,0.0,0,0.0,0.0,0.0,0.0,0,0,0,0.0,0,0,0.0,0,0,0.0,0.0,0,0.0,0.0,0.0,0.0,0,0,0.0,0,0,0,0,0.0,0.0,0.0,0.0,0,0,0,0,0,0,0,0,0.0,0,0.0,0.0,0.0,0.0,0.0,0.0,0,0.0,0,0,0,0,0,0.0,0,0.0,0.0,0.0,0,0.0,0,0.0,0,0,0,0,0,0,0,0.0,0.0,0,0.0,0,0,0.0,0,0,0,0,0,0,0,0,0.0,0.0,0,0,0.0,0,0.0,0,0,0,0.0,0.0,0,0,0,0,0,0.0,0,0.0,0.0,0.0,0.0,30000,https://www.zhihu.com/question/438111506/answer/1663818665,CN,CN,"i saw 1, he had an infected new crown in the uk in april 2020, which is from south korea in december. 4 detection in south korea is a critical value, and i don't know that this test results are simulated or numbers.
 i didn't discuss it first, and he went 14 days + 1 night from south korea. in guangdong province, it turned several cities: i think this kind of overseas staff should never have more time a few days? then january 1st to zhejiang
 hangzhou, the epidemic is so serious, if it is back to work, how can i go shopping in guangdong and then return to zhejiang? i can't understand.","['saw', '1', 'infect', 'new', 'crown', 'uk', 'april', '2020', 'south', 'korea', 'december', '4', 'detection', 'south', 'korea', 'critical', 'value', 'test', 'simulate', 'number', 'discuss', '14', 'days', '1', 'night', 'south', 'korea', 'guangdong', 'province', 'turn', 'cities', 'kind', 'overseas', 'staff', 'time', 'days', 'january', '1st', 'zhejiang', 'hangzhou', 'epidemic', 'serious', 'work', 'shop', 'guangdong', 'zhejiang']"
2,135,"[Changsha Travel Guide] Three-day journey, spending around 1600 yuan.
 Day1: Jiefang West Road - Temple - Taiping Street - Jiayi Former Residence - Orange Enthusiast Day2: Yuelu Mountain - Hunan University - Hunan Museum - Martyrs Park - Changsha University Moon Lake Park Day3: Hunan Radio and Television - World Window in the Go
 Don't tangle too much. If you encounter it, try it, people, you will be a little!
 Author: 儿",0,0.0,0,0,0.0,0.0,0,0.0,0,0,0.0,0.0,0.0,0.0,0,0,0.0,0,0,0.0,0,0.0,0,0,0,0,0.0,0.0,0.0,0,0,0,0,0.0,0,0.0,0,0.0,0,0,0,0.0,0,0,0.0,0,0.0,0,0,0,0,0.0,0,0,0.0,100,0,0.0,0,0.0,0,0,0,0.0,0.0,0.0,0.0,0,0,100,0,0,100,0,0.0,0.0,0.0,0,100,0.0,0.0,0,0,0.0,0,0,0.0,0.0,0,0,0,0,0.0,0.0,0.0,0,0,100,0.0,0,0,0,0.0,0.0,0.0,0.0,0.0,0,0.0,0,0.0,0,0,0,0,0,0.0,0,0,0,0.0,100,0,0,0.0,0.0,0,0,0,0,0,0,0,0.0,0,0.0,100,0,0.0,0,0,0,0.0,0,0,0,0,0,0.0,0.0,0,0,0.0,0.0,0.0,0.0,0,0,0,0,0,0.0,0,0,0.0,0.0,0,0,0,0,0.0,0,0.0,0.0,0,0,0.0,0,0,0.0,0,0.0,0,0,0.0,0.0,0.0,0,0,0,0,0,0.0,0,0,0,0,0.0,0.0,0.0,0.0,0,0,0,0,0,0.0,0,0,0.0,0,0,0,0,0.0,0,0.0,0.0,0.0,0,0.0,0.0,0.0,0.0,0,0,0,0,0.0,0.0,0.0,0,0.0,0.0,0.0,0,0,0.0,0,0,0,0,0.0,0.0,0.0,0,0,0,0,0.0,0,0,0,0,0,0,0,0.0,0.0,0.0,0.0,0,0,0.0,0,0.0,0.0,0.0,0.0,0,0,0,0.0,0,0,0.0,0,0,0.0,0.0,0,0.0,0.0,0.0,0.0,0,0,0.0,0,0,0,0,0.0,0.0,0.0,0.0,0,0,0,0,0,0,0,0,0.0,0,0.0,0.0,0.0,0.0,0.0,0.0,0,0.0,0,0,0,0,0,0.0,0,0.0,0.0,0.0,0,0.0,0,0.0,0,0,0,0,0,0,0,0.0,0.0,100,0.0,0,0,0.0,100,0,0,0,0,0,0,0,0.0,0.0,0,0,0.0,0,0.0,0,0,0,0.0,0.0,0,0,0,0,0,0.0,0,0.0,0.0,0.0,0.0,90000,http://weibo.com/6617946338/K4fMZwtNH,CN,CN,"[changsha travel guide] three-day journey, spending around 1600 yuan.
 day1: jiefang west road - temple - taiping street - jiayi former residence - orange enthusiast day2: yuelu mountain - hunan university - hunan museum - martyrs park - changsha university moon lake park day3: hunan radio and television - world window in the go
 don't tangle too much. if you encounter it, try it, people, you will be a little!
 author: 儿","['changsha', 'travel', 'guide', 'three', 'day', 'journey', 'spend', '1600', 'yuan', 'day1', 'jiefang', 'west', 'road', 'temple', 'taiping', 'street', 'jiayi', 'former', 'residence', 'orange', 'enthusiast', 'day2', 'yuelu', 'mountain', 'hunan', 'university', 'hunan', 'museum', 'martyr', 'park', 'changsha', 'university', 'moon', 'lake', 'park', 'day3', 'hunan', 'radio', 'television', 'world', 'window', 'tangle', 'much', 'encounter', 'try', 'people', 'little', 'author', '儿']"
3,147,"With Anhui guests, Xishuangbanna original forest park is playing!
 # 西双 版 旅游游 # ## 西双版 旅行 # # http: t.cn/a6Vmtivf ???",0,0.0,0,0,0.0,0.0,0,0.0,0,0,0.0,0.0,0.0,0.0,0,0,0.0,0,0,0.0,0,0.0,0,0,0,0,0.0,0.0,0.0,0,0,0,0,0.0,0,0.0,0,0.0,0,0,0,0.0,0,0,0.0,0,0.0,0,0,0,0,0.0,0,0,0.0,0,0,0.0,0,0.0,0,0,0,0.0,0.0,0.0,0.0,0,0,0,0,0,0,0,0.0,0.0,0.0,0,0,0.0,0.0,0,0,0.0,0,0,0.0,0.0,0,0,0,0,0.0,0.0,0.0,0,0,0,0.0,0,0,0,0.0,0.0,0.0,0.0,0.0,0,0.0,0,0.0,0,0,0,0,0,0.0,0,0,0,0.0,0,0,0,0.0,0.0,0,0,0,0,0,0,0,0.0,0,0.0,100,0,0.0,0,0,0,0.0,0,0,0,0,0,0.0,0.0,0,0,0.0,0.0,0.0,0.0,0,0,0,0,0,0.0,0,0,0.0,0.0,0,0,0,0,0.0,0,0.0,0.0,0,0,0.0,0,0,0.0,0,0.0,0,0,0.0,0.0,0.0,0,0,0,0,0,0.0,0,0,0,0,0.0,0.0,0.0,0.0,0,0,0,0,0,0.0,0,0,0.0,0,0,0,0,0.0,0,0.0,0.0,0.0,0,0.0,0.0,0.0,0.0,0,0,0,0,0.0,0.0,0.0,0,0.0,0.0,0.0,0,0,0.0,0,0,0,0,0.0,0.0,0.0,0,0,0,0,0.0,0,0,0,0,0,0,0,0.0,0.0,0.0,0.0,0,0,0.0,0,0.0,0.0,0.0,0.0,0,0,0,0.0,0,0,0.0,0,0,0.0,0.0,0,0.0,0.0,0.0,0.0,0,0,0.0,0,0,0,0,0.0,0.0,0.0,0.0,0,0,0,0,0,0,0,0,0.0,0,0.0,0.0,0.0,0.0,0.0,0.0,0,0.0,0,0,0,0,0,0.0,0,0.0,0.0,0.0,0,0.0,0,0.0,0,0,0,0,0,0,0,0.0,0.0,0,0.0,0,0,0.0,0,0,0,0,0,0,0,0,0.0,0.0,0,0,0.0,0,0.0,0,0,0,0.0,0.0,0,0,0,0,0,0.0,0,0.0,0.0,0.0,0.0,10000,http://weibo.com/7175097151/KgXuPeAYv,CN,CN,"with anhui guests, xishuangbanna original forest park is playing!
 # 西双 版 旅游游 # ## 西双版 旅行 # # http: t.cn/a6vmtivf ???","['anhui', 'guests', 'xishuangbanna', 'original', 'forest', 'park', 'play', '西双', '版', '西双版', '旅行', 'a6vmtivf']"
