238,9109,"@ 漫 大家:: 马!
 @ 超 凡 体育 birth: Chengdu travel Raiders, collected @ 次 元 Amway: Have a chance to go, Malang!
 [AWSL] @ 超 能 小: Chengdu food is too much [screen]",0,0.0,0,0,0.0,0.0,0,0.0,0,0,0.0,0.0,0.0,0.0,0,0,0.0,0,0,0.0,0,0.0,0,0,0,0,0.0,0.0,0.0,0,0,0,0,0.0,0,0.0,0,0.0,0,0,0,0.0,0,0,0.0,0,0.0,0,0,0,0,0.0,0,0,0.0,0,0,0.0,0,0.0,0,0,0,0.0,0.0,0.0,0.0,0,0,0,0,0,0,0,0.0,0.0,0.0,0,0,0.0,0.0,0,0,0.0,0,0,0.0,0.0,0,0,0,0,0.0,0.0,0.0,0,0,0,0.0,0,0,0,0.0,0.0,0.0,0.0,0.0,0,0.0,0,0.0,0,0,0,0,0,0.0,0,0,0,0.0,0,0,0,0.0,0.0,0,0,0,0,0,0,0,0.0,0,0.0,100,0,0.0,0,0,0,0.0,0,0,0,0,0,0.0,0.0,0,0,0.0,0.0,0.0,0.0,0,0,0,0,0,0.0,0,0,0.0,0.0,0,0,0,0,0.0,0,0.0,0.0,0,0,0.0,0,0,0.0,0,0.0,0,0,0.0,0.0,0.0,0,0,0,0,0,0.0,0,0,0,0,0.0,0.0,0.0,0.0,0,0,0,0,0,0.0,0,0,0.0,0,0,0,0,0.0,0,0.0,0.0,0.0,0,0.0,0.0,0.0,0.0,0,0,0,0,0.0,0.0,0.0,0,0.0,0.0,0.0,0,0,0.0,0,0,0,0,0.0,0.0,0.0,0,0,0,0,0.0,0,0,0,0,0,0,0,0.0,0.0,0.0,0.0,0,0,0.0,0,0.0,0.0,0.0,0.0,0,0,0,0.0,0,0,0.0,0,0,0.0,0.0,0,0.0,0.0,0.0,0.0,0,0,0.0,0,0,0,0,0.0,0.0,0.0,0.0,0,0,0,0,0,0,0,0,0.0,0,0.0,0.0,0.0,0.0,0.0,0.0,0,0.0,0,0,0,0,0,0.0,0,0.0,0.0,0.0,0,0.0,0,0.0,0,0,0,0,0,0,0,0.0,0.0,0,0.0,0,0,0.0,0,0,0,0,100,0,0,100,0.0,0.0,0,0,0.0,0,0.0,0,0,0,0.0,0.0,0,0,0,0,0,0.0,0,0.0,0.0,0.0,0.0,30000,http://weibo.com/3185353510/K4Qdn4Ruj,CN,CN,"@ 漫 大家:: 马!
 @ 超 凡 体育 birth: chengdu travel raiders, collected @ 次 元 amway: have a chance to go, malang!
 [awsl] @ 超 能 小: chengdu food is too much [screen]","['漫', '大家', '马', '凡', '体育', 'birth', 'chengdu', 'travel', 'collect', '次', 'amway', 'malang', 'awsl', '能', 'chengdu', 'food', 'much', 'screen']"
239,9124,"[Changsha Travel Guide] Three-day journey, spending around 1600 yuan.
 Day1: Jiefang West Road - Temple - Taiping Street - Jiayi Former Residence - Orange Enthusiast Day2: Yuelu Mountain - Hunan University - Hunan Museum - Martyrs Park - Changsha University Moon Lake Park Day3: Hunan Radio and Television - World Window in the Distance
 Don't tangle too much. If you encounter it, try it, people, you will be a little!
 Author: 儿? # 旅游 旅游 # ## 旅 美 ## 户外 旅游游 #",0,0.0,0,0,0.0,0.0,0,0.0,0,0,0.0,0.0,0.0,0.0,0,0,0.0,0,0,0.0,0,0.0,0,0,0,0,0.0,0.0,0.0,0,0,0,0,0.0,0,0.0,0,0.0,0,0,0,0.0,0,0,0.0,0,0.0,0,0,0,0,0.0,0,0,0.0,100,0,0.0,0,0.0,0,0,0,0.0,0.0,0.0,0.0,0,0,100,0,0,100,0,0.0,0.0,0.0,0,100,0.0,0.0,0,0,0.0,0,0,0.0,0.0,0,0,0,0,0.0,0.0,0.0,0,0,100,0.0,0,0,0,0.0,0.0,0.0,0.0,0.0,0,0.0,0,0.0,0,0,0,0,0,0.0,0,0,0,0.0,100,0,0,0.0,0.0,0,0,0,0,0,0,0,0.0,0,0.0,100,0,0.0,0,0,0,0.0,0,0,0,0,0,0.0,0.0,0,0,0.0,0.0,0.0,0.0,0,0,0,0,0,0.0,0,0,0.0,0.0,0,0,0,0,0.0,0,0.0,0.0,0,0,0.0,0,0,0.0,0,0.0,0,0,0.0,0.0,0.0,0,0,0,0,0,0.0,0,0,0,0,0.0,0.0,0.0,0.0,0,0,0,0,0,0.0,0,0,0.0,0,0,0,0,0.0,0,0.0,0.0,0.0,0,0.0,0.0,0.0,0.0,0,0,0,0,0.0,0.0,0.0,0,0.0,0.0,0.0,0,0,0.0,0,0,0,0,0.0,0.0,0.0,0,0,0,0,0.0,0,0,0,0,0,0,0,0.0,0.0,0.0,0.0,0,0,0.0,0,0.0,0.0,0.0,0.0,0,0,0,0.0,0,0,0.0,0,0,0.0,0.0,0,0.0,0.0,0.0,0.0,0,0,0.0,0,0,0,0,0.0,0.0,0.0,0.0,0,0,0,0,0,0,0,0,0.0,0,0.0,0.0,0.0,0.0,0.0,0.0,0,0.0,0,0,0,0,0,0.0,0,0.0,0.0,0.0,0,0.0,0,0.0,0,0,0,0,0,0,0,0.0,0.0,100,0.0,0,0,0.0,100,0,0,0,0,0,0,0,0.0,0.0,0,0,0.0,0,0.0,0,0,0,0.0,0.0,0,0,0,0,0,0.0,0,0.0,0.0,0.0,0.0,90000,http://weibo.com/1859423670/JElph7VOb,CN,CN,"[changsha travel guide] three-day journey, spending around 1600 yuan.
 day1: jiefang west road - temple - taiping street - jiayi former residence - orange enthusiast day2: yuelu mountain - hunan university - hunan museum - martyrs park - changsha university moon lake park day3: hunan radio and television - world window in the distance
 don't tangle too much. if you encounter it, try it, people, you will be a little!
 author: 儿? # 旅游 旅游 # ## 旅 美 ## 户外 旅游游 #","['changsha', 'travel', 'guide', 'three', 'day', 'journey', 'spend', '1600', 'yuan', 'day1', 'jiefang', 'west', 'road', 'temple', 'taiping', 'street', 'jiayi', 'former', 'residence', 'orange', 'enthusiast', 'day2', 'yuelu', 'mountain', 'hunan', 'university', 'hunan', 'museum', 'martyr', 'park', 'changsha', 'university', 'moon', 'lake', 'park', 'day3', 'hunan', 'radio', 'television', 'world', 'window', 'distance', 'tangle', 'much', 'encounter', 'try', 'people', 'little', 'author', '儿', '户外']"
240,9127,"I have also been to Nanjing, Jiangsu!",0,0.0,0,0,0.0,0.0,0,0.0,0,0,0.0,0.0,0.0,0.0,0,0,0.0,0,0,0.0,0,0.0,0,0,0,0,0.0,0.0,0.0,0,0,0,0,0.0,0,0.0,0,0.0,0,0,0,0.0,0,0,0.0,0,0.0,0,0,0,0,0.0,0,0,0.0,0,0,0.0,0,0.0,0,0,0,0.0,0.0,0.0,0.0,0,0,0,0,0,0,0,0.0,0.0,0.0,0,0,0.0,0.0,0,0,0.0,0,0,0.0,0.0,0,0,0,0,0.0,0.0,0.0,0,0,0,0.0,0,0,0,0.0,0.0,0.0,0.0,0.0,0,0.0,0,0.0,0,0,0,0,0,0.0,0,0,0,0.0,0,0,0,0.0,0.0,0,0,0,0,0,0,0,0.0,0,0.0,100,0,0.0,0,0,0,0.0,0,0,0,0,0,0.0,0.0,0,0,0.0,0.0,0.0,0.0,0,0,0,0,0,0.0,0,0,0.0,0.0,0,0,0,0,0.0,0,0.0,0.0,0,0,0.0,0,0,0.0,0,0.0,0,0,0.0,0.0,0.0,0,0,0,0,0,0.0,0,0,0,0,0.0,0.0,0.0,0.0,0,0,0,0,0,0.0,0,0,0.0,0,0,0,0,0.0,0,0.0,0.0,0.0,0,0.0,0.0,0.0,0.0,0,0,0,0,0.0,0.0,0.0,0,0.0,0.0,0.0,0,0,0.0,0,0,0,0,0.0,0.0,0.0,0,0,0,0,0.0,0,0,0,0,0,0,0,0.0,0.0,0.0,0.0,0,0,0.0,0,0.0,0.0,0.0,0.0,0,0,0,0.0,0,0,0.0,0,0,0.0,0.0,0,0.0,0.0,0.0,0.0,0,0,0.0,0,0,0,0,0.0,0.0,0.0,0.0,0,0,0,0,0,0,0,0,0.0,0,0.0,0.0,0.0,0.0,0.0,0.0,0,0.0,0,0,0,0,0,0.0,0,0.0,0.0,0.0,0,0.0,0,0.0,0,0,0,0,0,0,0,0.0,0.0,0,0.0,0,0,0.0,0,0,0,0,0,0,0,0,0.0,0.0,0,0,0.0,0,0.0,0,0,0,0.0,0.0,0,0,0,0,0,0.0,0,0.0,0.0,0.0,0.0,10000,http://weibo.com/1931901163/Ki8vugs6I,CN,CN,"i have also been to nanjing, jiangsu!","['nanjing', 'jiangsu']"
241,9144,"# 寨沟 旅游游 # From Chengdu New South Gate, the tea shop is a bus, the fare is only 10 hours, the price is about eight hours, the local home and B & B, the scenic spot is a Y-shaped, consisting of three trenches, two
 Route, Fujian attractions, Changhai, source wave Qingshui Jingshan forest five flower sea, water wave fiction, colorful colorful Pearl Beach Waterfall, water bead splash in the sun, like pearl general http: t.cn/a6v7h61j?",0,0.0,0,0,0.0,0.0,0,0.0,0,0,0.0,0.0,0.0,0.0,0,0,0.0,0,0,0.0,0,0.0,0,0,0,0,0.0,0.0,0.0,0,0,0,0,0.0,0,0.0,0,0.0,0,0,0,0.0,0,0,0.0,0,0.0,0,0,0,0,0.0,0,0,0.0,0,0,0.0,0,0.0,0,0,0,0.0,0.0,0.0,0.0,0,0,0,100,0,0,0,0.0,0.0,0.0,0,0,0.0,0.0,0,0,0.0,0,0,0.0,0.0,0,100,0,0,0.0,0.0,0.0,0,0,0,0.0,0,0,0,0.0,0.0,0.0,0.0,0.0,0,0.0,0,0.0,0,0,0,0,0,0.0,0,0,0,0.0,0,0,0,0.0,0.0,0,0,0,0,0,0,0,0.0,0,0.0,100,0,0.0,0,0,0,0.0,0,0,0,0,0,0.0,0.0,0,0,0.0,0.0,0.0,0.0,0,0,0,0,0,0.0,0,0,0.0,0.0,0,0,0,0,0.0,0,0.0,0.0,0,0,0.0,0,0,0.0,0,0.0,0,0,0.0,0.0,0.0,0,0,0,0,0,0.0,0,0,0,0,0.0,0.0,0.0,0.0,0,0,0,0,0,0.0,0,0,0.0,0,0,0,0,0.0,0,0.0,0.0,0.0,0,0.0,0.0,0.0,0.0,0,0,0,0,0.0,0.0,0.0,0,0.0,0.0,0.0,0,0,0.0,0,0,0,0,0.0,0.0,0.0,0,0,0,0,0.0,0,0,0,0,0,0,100,0.0,0.0,0.0,0.0,0,0,0.0,0,0.0,0.0,0.0,0.0,0,0,0,0.0,0,0,0.0,0,0,0.0,0.0,0,0.0,0.0,0.0,0.0,0,0,0.0,0,0,0,0,0.0,0.0,0.0,0.0,0,0,0,0,0,0,0,0,0.0,0,0.0,0.0,0.0,0.0,0.0,0.0,0,0.0,0,0,0,0,0,0.0,0,0.0,0.0,0.0,0,0.0,0,0.0,0,0,0,0,0,0,0,0.0,0.0,0,0.0,0,0,0.0,0,0,0,0,0,0,0,0,0.0,0.0,0,0,0.0,0,0.0,0,0,0,0.0,0.0,0,0,0,0,0,0.0,0,0.0,0.0,0.0,0.0,40000,http://weibo.com/6079295146/KeVr6h5Mq,CN,CN,"# 寨沟 旅游游 # from chengdu new south gate, the tea shop is a bus, the fare is only 10 hours, the price is about eight hours, the local home and b & b, the scenic spot is a y-shaped, consisting of three trenches, two
 route, fujian attractions, changhai, source wave qingshui jingshan forest five flower sea, water wave fiction, colorful colorful pearl beach waterfall, water bead splash in the sun, like pearl general http: t.cn/a6v7h61j?","['寨沟', 'chengdu', 'new', 'south', 'gate', 'tea', 'shop', 'bus', 'fare', '10', 'hours', 'price', 'eight', 'hours', 'local', 'home', 'b', 'b', 'scenic', 'spot', 'shape', 'consist', 'three', 'trench', 'two', 'route', 'fujian', 'attractions', 'changhai', 'source', 'wave', 'qingshui', 'jingshan', 'forest', 'five', 'flower', 'sea', 'water', 'wave', 'fiction', 'colorful', 'colorful', 'pearl', 'beach', 'waterfall', 'water', 'bead', 'splash', 'sun', 'pearl', 'general', 'a6v7h61j']"
242,9160,"[Nanxun Island Travel] What Maldives is going to see the sea!
 Jiangsu, Zhejiang and Shanghai shipping regions and only have time to travel in the weekend, hot summer, hurry to Nanxun to play water.
 More than the heart: 无 气 黄 小 小 小 小?? # 顶级 旅家 ## 旅游游 # ## 微 微 去 旅 # ???",0,0.0,0,0,0.0,0.0,0,0.0,0,0,0.0,0.0,0.0,0.0,0,0,0.0,0,0,0.0,0,0.0,0,0,0,0,0.0,0.0,0.0,0,0,0,0,0.0,0,0.0,0,0.0,0,0,0,0.0,0,0,0.0,0,0.0,0,0,0,0,0.0,0,0,0.0,0,0,0.0,0,0.0,0,0,0,0.0,0.0,0.0,0.0,0,0,0,0,0,0,0,0.0,0.0,0.0,0,0,0.0,0.0,0,0,0.0,0,0,0.0,0.0,0,0,0,0,0.0,0.0,0.0,0,0,0,0.0,0,0,0,0.0,0.0,0.0,0.0,0.0,0,0.0,0,0.0,0,0,0,0,0,0.0,0,0,0,0.0,0,0,0,0.0,0.0,0,0,0,0,0,0,0,0.0,0,0.0,100,0,0.0,0,0,0,0.0,0,0,0,0,0,0.0,0.0,0,0,0.0,0.0,0.0,0.0,0,0,0,0,0,0.0,0,0,0.0,0.0,0,0,0,0,0.0,0,0.0,0.0,0,0,0.0,0,0,0.0,0,0.0,0,0,0.0,0.0,0.0,0,0,0,0,0,0.0,0,0,0,0,0.0,0.0,0.0,0.0,0,0,0,0,0,0.0,0,0,0.0,0,0,100,0,0.0,0,0.0,0.0,0.0,0,0.0,0.0,0.0,0.0,0,0,0,0,0.0,0.0,0.0,0,0.0,0.0,0.0,0,0,0.0,0,0,0,0,0.0,0.0,0.0,0,0,0,0,0.0,0,0,0,0,0,0,0,0.0,0.0,0.0,0.0,0,0,0.0,0,0.0,0.0,0.0,0.0,0,0,0,0.0,0,0,0.0,0,0,0.0,0.0,0,0.0,0.0,0.0,0.0,0,0,0.0,0,0,0,0,0.0,0.0,0.0,0.0,0,0,0,0,0,0,0,0,0.0,0,0.0,0.0,0.0,0.0,0.0,0.0,0,0.0,0,0,0,0,0,0.0,0,0.0,0.0,0.0,0,0.0,0,0.0,0,0,0,0,0,0,0,0.0,0.0,0,0.0,0,0,0.0,100,0,0,0,0,0,0,0,0.0,0.0,0,0,0.0,0,0.0,0,0,0,0.0,0.0,0,0,0,0,0,0.0,0,0.0,0.0,0.0,0.0,30000,http://weibo.com/5519487499/K57Cfvgys,CN,CN,"[nanxun island travel] what maldives is going to see the sea!
 jiangsu, zhejiang and shanghai shipping regions and only have time to travel in the weekend, hot summer, hurry to nanxun to play water.
 more than the heart: 无 气 黄 小 小 小 小?? # 顶级 旅家 ## 旅游游 # ## 微 微 去 旅 # ???","['nanxun', 'island', 'travel', 'maldives', 'see', 'sea', 'jiangsu', 'zhejiang', 'shanghai', 'ship', 'regions', 'time', 'travel', 'weekend', 'hot', 'summer', 'hurry', 'nanxun', 'play', 'water', 'heart', '气', '黄', '顶级', '旅家', '去']"
243,9283,"What have you eaten by fruity grilled fish?
 Dandong's chain roast fish shop, queue can eat # 东 [超 话] # # 东 旅游游 [[超 话] # # 东 美食 [超 话] # # # 东 # [Chain Roasted Fish shop
 Dandong queues eat?
 A fish two eat fruity grilled fish, have you eaten? (Http: t.cn/a6fll68r) ???",0,0.0,0,0,0.0,0.0,0,0.0,0,0,0.0,0.0,0.0,0.0,0,0,0.0,0,0,0.0,0,0.0,0,0,0,0,0.0,0.0,0.0,0,0,0,0,0.0,0,0.0,0,0.0,0,0,0,0.0,0,0,0.0,0,0.0,0,0,0,0,0.0,0,0,0.0,0,0,0.0,0,0.0,0,0,0,0.0,0.0,0.0,0.0,0,0,0,50,0,0,0,0.0,0.0,0.0,0,0,0.0,0.0,0,0,0.0,0,0,0.0,0.0,0,0,0,0,0.0,0.0,0.0,0,0,0,0.0,0,0,0,0.0,0.0,0.0,0.0,0.0,0,0.0,0,0.0,0,0,0,0,0,0.0,0,0,0,0.0,0,0,0,0.0,0.0,0,0,0,200,0,0,0,0.0,0,0.0,0,0,0.0,0,0,0,0.0,0,0,0,0,0,0.0,0.0,0,0,0.0,0.0,0.0,0.0,0,0,0,0,0,0.0,0,0,0.0,0.0,0,0,0,0,0.0,0,0.0,0.0,0,0,0.0,0,0,0.0,0,0.0,0,0,0.0,0.0,0.0,0,0,0,0,0,0.0,0,0,0,0,0.0,0.0,0.0,0.0,0,0,0,0,0,0.0,0,0,0.0,0,0,0,0,0.0,0,0.0,0.0,0.0,0,0.0,0.0,0.0,0.0,0,0,0,0,0.0,0.0,0.0,0,0.0,0.0,0.0,0,0,0.0,0,0,0,0,0.0,0.0,0.0,0,0,0,0,0.0,0,0,0,0,50,0,0,0.0,0.0,0.0,0.0,0,0,0.0,0,0.0,0.0,0.0,0.0,0,0,0,0.0,0,0,0.0,0,0,0.0,0.0,0,0.0,0.0,0.0,0.0,0,0,0.0,0,0,0,0,0.0,0.0,0.0,0.0,0,0,0,0,0,0,0,0,0.0,0,0.0,0.0,0.0,0.0,0.0,0.0,0,0.0,0,0,0,0,0,0.0,0,0.0,0.0,0.0,0,0.0,0,0.0,0,0,0,0,0,0,0,0.0,0.0,0,0.0,0,0,0.0,0,0,0,0,0,0,0,0,0.0,0.0,0,0,0.0,0,0.0,0,0,0,0.0,0.0,0,0,0,0,0,0.0,0,0.0,0.0,0.0,0.0,25000,http://weibo.com/5694562821/Klvq3Az9b,CN,CN,"what have you eaten by fruity grilled fish?
 dandong's chain roast fish shop, queue can eat # 东 [超 话] # # 东 旅游游 [[超 话] # # 东 美食 [超 话] # # # 东 # [chain roasted fish shop
 dandong queues eat?
 a fish two eat fruity grilled fish, have you eaten? (http: t.cn/a6fll68r) ???","['eat', 'fruity', 'grill', 'fish', 'dandongs', 'chain', 'roast', 'fish', 'shop', 'queue', 'eat', '东', '东', '东', '东', 'chain', 'roast', 'fish', 'shop', 'dandong', 'queue', 'eat', 'fish', 'two', 'eat', 'fruity', 'grill', 'fish', 'eat', 'a6fll68r']"
244,9285,I really want to write a Kunming food travel guide who understands?????,0,0.0,0,0,0.0,0.0,0,0.0,0,0,0.0,0.0,0.0,0.0,0,0,0.0,0,0,0.0,0,0.0,0,0,0,0,0.0,0.0,0.0,0,0,0,0,0.0,0,0.0,0,0.0,0,0,0,0.0,0,0,0.0,0,0.0,0,0,0,0,0.0,0,0,0.0,0,0,0.0,0,0.0,0,0,0,0.0,0.0,0.0,0.0,0,0,0,0,0,0,0,0.0,0.0,0.0,0,0,0.0,0.0,0,0,0.0,0,0,0.0,0.0,0,0,0,0,0.0,0.0,0.0,0,0,0,0.0,0,0,0,0.0,0.0,0.0,0.0,0.0,0,0.0,0,0.0,0,0,0,0,0,0.0,0,0,0,0.0,0,0,0,0.0,0.0,0,0,0,0,0,0,0,0.0,0,0.0,100,0,0.0,0,0,0,0.0,0,0,0,0,0,0.0,0.0,0,0,0.0,0.0,0.0,0.0,0,0,0,0,0,0.0,0,0,0.0,0.0,0,0,0,0,0.0,0,0.0,0.0,0,0,0.0,0,0,0.0,0,0.0,0,0,0.0,0.0,0.0,0,0,0,0,0,0.0,0,0,0,0,0.0,0.0,0.0,0.0,0,0,0,0,0,0.0,0,0,0.0,0,0,0,0,0.0,0,0.0,0.0,0.0,0,0.0,0.0,0.0,0.0,0,0,0,0,0.0,0.0,0.0,0,0.0,0.0,0.0,0,0,0.0,0,0,0,0,0.0,0.0,0.0,0,0,0,0,0.0,0,0,0,0,0,0,0,0.0,0.0,0.0,0.0,0,0,0.0,0,0.0,0.0,0.0,0.0,0,0,0,0.0,0,0,0.0,0,0,0.0,0.0,0,0.0,0.0,0.0,0.0,0,0,0.0,0,0,0,0,0.0,0.0,0.0,0.0,0,0,0,0,0,0,0,0,0.0,0,0.0,0.0,0.0,0.0,0.0,0.0,0,0.0,0,0,0,0,0,0.0,0,0.0,0.0,0.0,0,0.0,0,0.0,0,0,0,0,0,0,0,0.0,0.0,0,0.0,0,0,0.0,0,0,0,0,100,0,0,0,0.0,0.0,0,0,0.0,0,0.0,0,0,0,0.0,0.0,0,0,0,0,0,0.0,0,0.0,0.0,0.0,0.0,20000,http://weibo.com/2620567681/KlRoi4u90,CN,CN,i really want to write a kunming food travel guide who understands?????,"['write', 'kunming', 'food', 'travel', 'guide']"
245,9311,"Passionate summer, R car Taiyuan Maoye Tiandi Experience Center leads customers to the Yunzhonghe house car base, sharing the cheerful weekend.
 At 9:30 in the morning, the Shanxi Stadium Collection, at 11 o'clock to the designated place, start free barbecue, after a while, starting our parent-child activities, in the process of the game, parents and children are actively cooperating, increase the car
 Everyone is very happy.",200,0.0,0,0,0.0,0.0,0,0.0,0,0,0.0,0.0,0.0,0.0,0,0,0.0,0,0,0.0,0,0.0,0,0,0,0,0.0,0.0,0.0,0,0,0,0,0.0,0,0.0,0,0.0,0,0,0,0.0,0,0,0.0,0,0.0,0,0,0,0,0.0,0,0,0.0,0,0,0.0,0,0.0,0,0,0,0.0,0.0,0.0,0.0,0,0,0,0,0,0,0,0.0,0.0,0.0,0,0,0.0,0.0,0,0,0.0,0,0,0.0,0.0,0,0,0,0,0.0,0.0,0.0,0,0,0,0.0,0,0,0,0.0,0.0,0.0,0.0,0.0,0,0.0,0,0.0,0,0,0,0,0,0.0,0,0,50,0.0,0,0,0,0.0,0.0,0,0,0,50,0,0,0,0.0,0,0.0,0,0,0.0,0,0,0,0.0,0,0,0,0,0,0.0,0.0,0,0,0.0,0.0,0.0,0.0,0,0,0,0,0,0.0,0,0,0.0,0.0,0,0,0,0,0.0,0,0.0,0.0,0,0,0.0,0,0,0.0,0,0.0,0,0,0.0,0.0,0.0,0,0,0,0,0,0.0,0,0,0,0,0.0,0.0,0.0,0.0,0,0,0,0,0,0.0,0,0,0.0,0,0,0,0,0.0,0,0.0,0.0,0.0,0,0.0,0.0,0.0,0.0,0,0,0,0,0.0,0.0,0.0,0,0.0,0.0,0.0,0,0,0.0,0,0,0,0,0.0,0.0,0.0,0,0,0,0,0.0,0,0,0,0,0,0,0,0.0,0.0,0.0,0.0,0,0,0.0,0,0.0,0.0,0.0,0.0,0,0,0,0.0,0,0,0.0,0,0,0.0,0.0,0,0.0,0.0,0.0,0.0,0,0,0.0,0,0,0,0,0.0,0.0,0.0,0.0,0,0,0,0,0,0,0,0,0.0,0,0.0,0.0,0.0,0.0,0.0,0.0,0,0.0,0,0,0,0,0,0.0,0,0.0,0.0,0.0,0,0.0,0,0.0,0,0,0,0,0,0,0,0.0,0.0,0,0.0,0,0,0.0,0,0,0,0,0,0,0,0,0.0,0.0,0,0,0.0,0,0.0,0,0,0,0.0,0.0,0,0,0,0,0,0.0,0,0.0,0.0,0.0,0.0,25000,https://zhuanlan.zhihu.com/p/383245300,CN,CN,"passionate summer, r car taiyuan maoye tiandi experience center leads customers to the yunzhonghe house car base, sharing the cheerful weekend.
 at 9:30 in the morning, the shanxi stadium collection, at 11 o'clock to the designated place, start free barbecue, after a while, starting our parent-child activities, in the process of the game, parents and children are actively cooperating, increase the car
 everyone is very happy.","['passionate', 'summer', 'r', 'car', 'taiyuan', 'maoye', 'tiandi', 'experience', 'center', 'lead', 'customers', 'yunzhonghe', 'house', 'car', 'base', 'share', 'cheerful', 'weekend', '930', 'morning', 'shanxi', 'stadium', 'collection', '11', 'oclock', 'designate', 'place', 'start', 'free', 'barbecue', 'start', 'parent', 'child', 'activities', 'process', 'game', 'parent', 'children', 'actively', 'cooperate', 'increase', 'car', 'happy']"
246,9332,"2/20 Baby Amusement Park and Park a day, my car was stolen in the amusement park, and the amusement park did not manage it. It is the responsibility of both parties. I will pay for me 100 yuan. What should I do?
 Not much about how much money, this attitude is very speechless 1 breakfast: 10 dumplings, eggs 2 morning fruit: grapefruit kiwi 3 daughter lunch: Egg green meat endo my lunch: rice garlic seedlings.
 Red burnt meat.
 Pastry Shakima cooking?",50,0.0,0,0,0.0,0.0,0,0.0,0,0,0.0,0.0,0.0,0.0,0,0,0.0,0,0,0.0,0,0.0,0,0,0,0,0.0,0.0,0.0,0,0,0,0,0.0,0,0.0,0,0.0,0,0,0,0.0,0,0,0.0,0,0.0,0,0,0,0,0.0,0,0,0.0,0,0,0.0,0,0.0,0,0,0,0.0,0.0,0.0,0.0,0,0,0,0,0,0,0,0.0,0.0,0.0,0,0,0.0,0.0,0,0,0.0,0,0,0.0,0.0,0,0,50,0,0.0,0.0,0.0,0,0,0,0.0,0,0,0,0.0,0.0,0.0,0.0,0.0,0,0.0,0,0.0,0,0,0,0,0,0.0,0,0,0,0.0,0,0,0,0.0,0.0,0,0,0,0,50,200,0,0.0,0,0.0,0,0,0.0,0,0,0,0.0,0,0,0,0,0,0.0,0.0,0,0,0.0,0.0,0.0,0.0,0,0,0,0,0,0.0,0,0,0.0,0.0,0,0,0,0,0.0,0,0.0,0.0,0,0,0.0,0,0,0.0,0,0.0,0,0,0.0,0.0,0.0,0,0,0,0,0,0.0,0,0,0,0,0.0,0.0,0.0,0.0,0,0,0,0,0,0.0,0,0,0.0,0,0,0,0,0.0,0,0.0,0.0,0.0,0,0.0,0.0,0.0,0.0,0,0,0,0,0.0,0.0,0.0,0,0.0,0.0,0.0,0,0,0.0,0,0,0,0,0.0,0.0,0.0,0,0,0,0,0.0,0,0,0,0,0,0,0,0.0,0.0,0.0,0.0,0,0,0.0,0,0.0,0.0,0.0,0.0,0,0,0,0.0,0,0,0.0,0,0,0.0,0.0,0,0.0,0.0,0.0,0.0,0,0,0.0,0,0,0,0,0.0,0.0,0.0,0.0,0,0,0,0,0,0,0,0,0.0,0,0.0,0.0,0.0,0.0,0.0,0.0,0,0.0,0,0,0,0,0,0.0,0,0.0,0.0,0.0,0,0.0,0,0.0,0,0,0,0,0,0,0,0.0,0.0,0,0.0,0,0,0.0,0,0,0,0,0,0,0,0,0.0,0.0,0,50,0.0,0,0.0,0,0,0,0.0,0.0,0,0,0,0,0,0.0,0,0.0,0.0,0.0,0.0,30000,http://weibo.com/2459243520/K2Qyf6d19,CN,CN,"2/20 baby amusement park and park a day, my car was stolen in the amusement park, and the amusement park did not manage it. it is the responsibility of both parties. i will pay for me 100 yuan. what should i do?
 not much about how much money, this attitude is very speechless 1 breakfast: 10 dumplings, eggs 2 morning fruit: grapefruit kiwi 3 daughter lunch: egg green meat endo my lunch: rice garlic seedlings.
 red burnt meat.
 pastry shakima cooking?","['2', '20', 'baby', 'amusement', 'park', 'park', 'day', 'car', 'steal', 'amusement', 'park', 'amusement', 'park', 'manage', 'responsibility', 'party', 'pay', '100', 'yuan', 'much', 'much', 'money', 'attitude', 'speechless', '1', 'breakfast', '10', 'dumplings', 'egg', '2', 'morning', 'fruit', 'grapefruit', 'kiwi', '3', 'daughter', 'lunch', 'egg', 'green', 'meat', 'endo', 'lunch', 'rice', 'garlic', 'seedlings', 'red', 'burn', 'meat', 'pastry', 'shakima', 'cook']"
247,9426,"[The most complete tea of the history ""Tourism Raiders in Qinghai] Qinghai tea, China's sky, how beautiful tea, Salt Lake, how to play?
 How to take pictures?
 This Raiders will tell you that the answer will be prepared for the eleventh small holiday ~???",0,0.0,0,0,0.0,0.0,0,0.0,0,0,0.0,0.0,0.0,0.0,0,0,0.0,0,0,0.0,0,0.0,0,0,0,0,0.0,0.0,0.0,0,0,0,0,0.0,0,0.0,0,0.0,0,0,0,0.0,0,0,0.0,0,0.0,0,0,0,0,0.0,0,0,0.0,0,0,0.0,0,0.0,0,0,0,0.0,0.0,0.0,0.0,0,0,0,0,0,0,0,0.0,0.0,0.0,0,0,0.0,0.0,0,0,0.0,0,0,0.0,0.0,0,0,0,0,0.0,0.0,0.0,0,0,0,0.0,0,0,0,0.0,0.0,0.0,0.0,0.0,0,0.0,0,0.0,0,0,0,0,0,0.0,0,0,0,0.0,0,0,0,0.0,0.0,0,0,0,0,0,0,0,0.0,0,0.0,100,0,0.0,0,0,0,0.0,0,0,0,0,0,0.0,0.0,0,0,0.0,0.0,0.0,0.0,0,0,0,0,0,0.0,0,0,0.0,0.0,0,0,0,0,0.0,0,0.0,0.0,0,0,0.0,0,0,0.0,0,0.0,0,0,0.0,0.0,0.0,0,0,0,0,0,0.0,0,0,0,0,0.0,0.0,0.0,0.0,0,0,0,0,0,0.0,0,0,0.0,0,0,0,0,0.0,0,0.0,0.0,0.0,0,0.0,0.0,0.0,0.0,0,0,0,0,0.0,0.0,0.0,0,0.0,0.0,0.0,0,0,0.0,0,0,0,0,0.0,0.0,0.0,0,0,0,0,0.0,0,0,0,0,0,0,0,0.0,0.0,0.0,0.0,0,0,0.0,0,0.0,0.0,0.0,0.0,0,0,0,0.0,0,0,0.0,0,0,0.0,0.0,0,0.0,0.0,0.0,0.0,0,0,0.0,0,0,0,0,0.0,0.0,0.0,0.0,0,0,0,0,0,0,0,0,0.0,0,0.0,0.0,0.0,0.0,0.0,0.0,0,0.0,0,0,0,0,0,0.0,0,0.0,0.0,0.0,0,0.0,0,0.0,0,0,0,0,0,0,0,0.0,0.0,0,0.0,0,0,0.0,0,0,0,0,100,0,0,100,0.0,0.0,100,0,0.0,0,0.0,0,0,0,0.0,0.0,0,0,0,0,0,0.0,0,0.0,0.0,0.0,0.0,40000,http://weibo.com/7041914229/K8SjKxIL9,CN,CN,"[the most complete tea of the history ""tourism raiders in qinghai] qinghai tea, china's sky, how beautiful tea, salt lake, how to play?
 how to take pictures?
 this raiders will tell you that the answer will be prepared for the eleventh small holiday ~???","['complete', 'tea', 'history', 'tourism', 'qinghai', 'qinghai', 'tea', 'chinas', 'sky', 'beautiful', 'tea', 'salt', 'lake', 'play', 'picture', 'tell', 'prepare', 'eleventh', 'small', 'holiday']"
248,9427,"Leisurely visit Chengdu early to see the lovely round rolling giant panda eat the authentic Chengdu snack pickup
 : //t.cn/rbsr99b?",0,0.0,0,0,0.0,0.0,0,0.0,0,0,0.0,0.0,0.0,0.0,0,0,0.0,0,0,0.0,0,0.0,0,0,0,0,0.0,0.0,0.0,0,0,0,0,0.0,0,0.0,0,0.0,0,0,0,0.0,0,0,0.0,0,0.0,0,0,0,0,0.0,0,0,0.0,0,0,0.0,0,0.0,0,0,0,0.0,0.0,0.0,0.0,0,0,0,0,0,0,0,0.0,0.0,0.0,0,0,0.0,0.0,0,0,0.0,0,0,0.0,0.0,0,0,0,0,0.0,0.0,0.0,0,0,0,0.0,0,0,0,0.0,0.0,0.0,0.0,0.0,0,0.0,0,0.0,0,0,0,0,0,0.0,0,0,0,0.0,0,0,0,0.0,0.0,0,0,0,0,0,0,0,0.0,0,0.0,100,0,0.0,0,0,0,0.0,0,0,0,0,0,0.0,0.0,0,0,0.0,0.0,0.0,0.0,0,0,0,0,0,0.0,0,0,0.0,0.0,0,0,0,0,0.0,0,0.0,0.0,0,0,0.0,0,0,0.0,0,0.0,0,0,0.0,0.0,0.0,0,0,0,0,0,0.0,0,0,0,0,0.0,0.0,0.0,0.0,0,0,0,0,0,0.0,0,0,0.0,0,0,0,0,0.0,0,0.0,0.0,0.0,0,0.0,0.0,0.0,0.0,0,0,0,0,0.0,0.0,0.0,0,0.0,0.0,0.0,0,0,0.0,0,0,0,0,0.0,0.0,0.0,0,0,0,0,0.0,0,0,0,0,0,0,0,0.0,0.0,0.0,0.0,0,0,0.0,0,0.0,0.0,0.0,0.0,0,0,0,0.0,0,0,0.0,0,0,0.0,0.0,0,0.0,0.0,0.0,0.0,0,0,0.0,0,0,0,0,0.0,0.0,0.0,0.0,0,0,0,0,0,0,0,0,0.0,0,0.0,0.0,0.0,0.0,0.0,0.0,0,0.0,0,0,0,0,0,0.0,0,0.0,0.0,0.0,0,0.0,0,0.0,0,0,0,0,0,0,0,0.0,0.0,0,0.0,0,0,0.0,0,0,0,0,0,0,0,0,0.0,0.0,0,0,0.0,0,0.0,0,0,0,0.0,0.0,0,0,0,0,0,0.0,0,0.0,0.0,0.0,0.0,10000,http://weibo.com/1840315381/K8CoSv9T2,CN,CN,"leisurely visit chengdu early to see the lovely round rolling giant panda eat the authentic chengdu snack pickup
 : //t.cn/rbsr99b?","['leisurely', 'visit', 'chengdu', 'early', 'see', 'round', 'roll', 'giant', 'panda', 'eat', 'authentic', 'chengdu', 'snack', 'pickup', 'rbsr99b']"
249,9435,"Good guy abalone Pagger elephant 拔 蚌 蚌 [酸] @ 海天: 乡 [[特] @: [酸] I haven't been to Fujian @ HARPS: I don't have to use
 Go to Shanghai to eat a precious food, I will go to Fujian into the country!
 @ 透蓝 瓶子: Fuqing sea breaker is really absolute!
 I saw a colleague to buy a box of eating, there is a sea bream, a saucer, and the savory taste @ 螽斯 -:? There is a little envious",0,0.0,0,0,0.0,0.0,0,0.0,0,0,0.0,0.0,0.0,0.0,0,0,0.0,0,0,0.0,0,0.0,0,0,0,0,0.0,0.0,0.0,0,0,0,0,0.0,0,0.0,0,0.0,0,0,0,0.0,0,0,0.0,0,0.0,0,0,0,0,0.0,0,0,0.0,0,0,0.0,0,0.0,0,0,0,0.0,0.0,0.0,0.0,0,0,0,0,0,0,0,0.0,0.0,0.0,0,0,0.0,0.0,0,0,0.0,0,0,0.0,0.0,0,0,0,0,0.0,0.0,0.0,0,0,0,0.0,0,0,0,0.0,0.0,0.0,0.0,0.0,0,0.0,0,0.0,0,0,0,0,0,0.0,0,0,0,0.0,0,0,0,0.0,0.0,0,0,0,0,0,0,0,0.0,0,0.0,200,0,0.0,0,0,0,0.0,0,0,0,0,0,0.0,0.0,0,0,0.0,0.0,0.0,0.0,0,0,0,0,0,0.0,0,0,0.0,0.0,0,0,0,0,0.0,0,0.0,0.0,0,0,0.0,0,0,0.0,0,0.0,0,0,0.0,0.0,0.0,0,0,0,0,0,0.0,0,0,0,0,0.0,0.0,0.0,0.0,0,0,0,0,0,0.0,0,0,0.0,0,0,0,0,0.0,0,0.0,0.0,0.0,0,0.0,0.0,0.0,0.0,0,0,0,0,0.0,0.0,0.0,0,0.0,0.0,0.0,0,0,0.0,0,0,0,0,0.0,0.0,0.0,0,0,0,0,0.0,0,0,0,0,0,0,0,0.0,0.0,0.0,0.0,0,0,0.0,0,0.0,0.0,0.0,0.0,0,0,0,0.0,0,0,0.0,0,0,0.0,0.0,0,0.0,0.0,0.0,0.0,0,0,0.0,0,0,0,0,0.0,0.0,0.0,0.0,0,0,0,0,0,0,0,0,0.0,0,0.0,0.0,0.0,0.0,0.0,0.0,0,0.0,0,0,0,0,0,0.0,0,0.0,0.0,0.0,0,0.0,0,0.0,0,0,0,0,0,0,0,0.0,0.0,0,0.0,0,0,0.0,0,0,0,0,0,0,0,0,0.0,0.0,0,0,0.0,0,0.0,0,0,0,0.0,0.0,0,0,0,0,0,0.0,0,0.0,0.0,0.0,0.0,20000,http://weibo.com/1737597351/KhL511pWc,CN,CN,"good guy abalone pagger elephant 拔 蚌 蚌 [酸] @ 海天: 乡 [[特] @: [酸] i haven't been to fujian @ harps: i don't have to use
 go to shanghai to eat a precious food, i will go to fujian into the country!
 @ 透蓝 瓶子: fuqing sea breaker is really absolute!
 i saw a colleague to buy a box of eating, there is a sea bream, a saucer, and the savory taste @ 螽斯 -:? there is a little envious","['good', 'guy', 'abalone', 'pagger', 'elephant', '拔', '蚌', '蚌', '海天', '乡', '特', 'fujian', 'harp', 'shanghai', 'eat', 'precious', 'food', 'fujian', 'country', '透蓝', '瓶子', 'fuqing', 'sea', 'breaker', 'absolute', 'saw', 'colleague', 'buy', 'box', 'eat', 'sea', 'bream', 'saucer', 'savory', 'taste', '螽斯', 'little', 'envious']"
