167,6328,"# 旅游 旅游 攻 ## 自行 攻 略 ## 南 旅游游 # 家 晚 沙, 张家界, Phoenix [with Weibo to travel] Hunan free travel ~ Three years ago Hunan recently wanted to go to Changsha ~
 ~ Share [rabbit] [rabbit] @ 南 旅游 @ 长沙 市 市 局 @ 张家 界 旅游游 @ 张家 界 同 会 会 @ 凰 古城 微 博 @ 我 旅 菌 菌 @ 余韵 旅 旅 @ 旅 马 小 马 @ 豆 旅网 网 @ 南
 Ecotourism [Xiamen] (http: t.cn/r5dgyvl)",0,0.0,0,0,0.0,0.0,0,0.0,0,0,0.0,0.0,0.0,0.0,0,0,0.0,0,0,0.0,0,0.0,0,0,0,0,0.0,0.0,0.0,0,0,0,0,0.0,0,0.0,0,0.0,0,0,0,0.0,0,0,0.0,0,0.0,0,0,0,0,0.0,0,0,0.0,0,0,0.0,0,0.0,0,0,0,0.0,0.0,0.0,0.0,0,0,0,0,0,0,0,0.0,0.0,0.0,0,0,0.0,0.0,0,0,0.0,0,0,0.0,0.0,0,0,0,0,0.0,0.0,0.0,0,0,0,0.0,0,0,0,0.0,0.0,0.0,0.0,0.0,0,0.0,0,0.0,0,0,0,0,0,0.0,0,0,0,0.0,0,0,0,0.0,0.0,0,0,0,0,0,0,0,0.0,0,0.0,50,0,0.0,0,0,0,0.0,0,0,0,0,0,0.0,0.0,0,0,0.0,0.0,0.0,0.0,0,0,0,0,0,0.0,0,0,0.0,0.0,0,0,0,0,0.0,0,0.0,0.0,0,0,0.0,0,0,0.0,0,0.0,0,0,0.0,0.0,0.0,0,0,0,0,0,0.0,0,0,0,0,0.0,0.0,0.0,0.0,0,0,0,0,0,0.0,0,0,0.0,0,0,0,0,0.0,0,0.0,0.0,0.0,0,0.0,0.0,0.0,0.0,0,0,0,0,0.0,0.0,0.0,0,0.0,0.0,0.0,0,0,0.0,0,0,0,0,0.0,0.0,0.0,0,0,0,50,0.0,0,0,0,0,0,0,0,0.0,0.0,0.0,0.0,0,0,0.0,0,0.0,0.0,0.0,0.0,0,0,0,0.0,0,0,0.0,0,0,0.0,0.0,0,0.0,0.0,0.0,0.0,0,0,0.0,0,0,0,0,0.0,0.0,0.0,0.0,0,0,0,0,0,0,0,0,0.0,0,0.0,0.0,0.0,0.0,0.0,0.0,0,0.0,0,0,0,0,0,0.0,0,0.0,0.0,0.0,0,0.0,0,0.0,0,0,0,0,0,0,0,0.0,0.0,0,0.0,0,0,0.0,200,0,0,0,0,0,0,0,0.0,0.0,0,0,0.0,0,0.0,0,0,0,0.0,0.0,0,0,0,0,0,0.0,0,0.0,0.0,0.0,0.0,25000,http://weibo.com/3455508194/KnQQPjp8S,CN,CN,"# 旅游 旅游 攻 ## 自行 攻 略 ## 南 旅游游 # 家 晚 沙, 张家界, phoenix [with weibo to travel] hunan free travel ~ three years ago hunan recently wanted to go to changsha ~
 ~ share [rabbit] [rabbit] @ 南 旅游 @ 长沙 市 市 局 @ 张家 界 旅游游 @ 张家 界 同 会 会 @ 凰 古城 微 博 @ 我 旅 菌 菌 @ 余韵 旅 旅 @ 旅 马 小 马 @ 豆 旅网 网 @ 南
 ecotourism [xiamen] (http: t.cn/r5dgyvl)","['自行', '家', '晚', '沙', '张家界', 'phoenix', 'weibo', 'travel', 'hunan', 'free', 'travel', 'three', 'hunan', 'recently', 'changsha', 'share', 'rabbit', 'rabbit', '市', '市', '局', '张家', '界', '张家', '界', '凰', '古城', '我', '余韵', '马', '马', '豆', '旅网', 'ecotourism', 'xiamen', 'r5dgyvl']"
168,6442,"[Tears] @ 海天: 乡 [特曼] @ 惜: [酸] I haven't been to Fujian @ @ 李子:: @ HARPS: I don't have to go to Shanghai to eat more expensive
 Gourmet, I will go to Fujian into the country!
 @ 煌 公: @ @ 透 蓝 瓶子: Fuqing sea breaker is really absolute!
 I saw a colleague to buy a box of eating, there is a sea bream, a saucer, and the savory taste @ 螽斯 -:? There is a little envious",0,0.0,0,0,0.0,0.0,0,0.0,0,0,0.0,0.0,0.0,0.0,0,0,0.0,0,0,0.0,0,0.0,0,0,0,0,0.0,0.0,0.0,0,0,0,0,0.0,0,0.0,0,0.0,0,0,0,0.0,0,0,0.0,0,0.0,0,0,0,0,0.0,0,0,0.0,0,0,0.0,0,0.0,0,0,0,0.0,0.0,0.0,0.0,0,0,0,0,0,0,0,0.0,0.0,0.0,0,0,0.0,0.0,0,0,0.0,0,0,0.0,0.0,0,0,0,0,0.0,0.0,0.0,0,0,0,0.0,0,0,0,0.0,0.0,0.0,0.0,0.0,0,0.0,0,0.0,0,0,0,0,0,0.0,0,0,0,0.0,0,0,0,0.0,0.0,0,0,0,0,0,0,0,0.0,0,0.0,200,0,0.0,0,0,0,0.0,0,0,0,0,0,0.0,0.0,0,0,0.0,0.0,0.0,0.0,0,0,0,0,0,0.0,0,0,0.0,0.0,0,0,0,0,0.0,0,0.0,0.0,0,0,0.0,0,0,0.0,0,0.0,0,0,0.0,0.0,0.0,0,0,0,0,0,0.0,0,0,0,0,0.0,0.0,0.0,0.0,0,0,0,0,0,0.0,0,0,0.0,0,0,0,0,0.0,0,0.0,0.0,0.0,0,0.0,0.0,0.0,0.0,0,0,0,0,0.0,0.0,0.0,0,0.0,0.0,0.0,0,0,0.0,0,0,0,0,0.0,0.0,0.0,0,0,0,0,0.0,0,0,0,0,0,0,0,0.0,0.0,0.0,0.0,0,0,0.0,0,0.0,0.0,0.0,0.0,0,0,0,0.0,0,0,0.0,0,0,0.0,0.0,0,0.0,0.0,0.0,0.0,0,0,0.0,0,0,0,0,0.0,0.0,0.0,0.0,0,0,0,0,0,0,0,0,0.0,0,0.0,0.0,0.0,0.0,0.0,0.0,0,0.0,0,0,0,0,0,0.0,0,0.0,0.0,0.0,0,0.0,0,0.0,0,0,0,0,0,0,0,0.0,0.0,0,0.0,0,0,0.0,0,0,0,0,0,0,0,0,0.0,0.0,0,0,0.0,0,0.0,0,0,0,0.0,0.0,0,0,0,0,0,0.0,0,0.0,0.0,0.0,0.0,20000,http://weibo.com/1240108812/KhKdNBITq,CN,CN,"[tears] @ 海天: 乡 [特曼] @ 惜: [酸] i haven't been to fujian @ @ 李子:: @ harps: i don't have to go to shanghai to eat more expensive
 gourmet, i will go to fujian into the country!
 @ 煌 公: @ @ 透 蓝 瓶子: fuqing sea breaker is really absolute!
 i saw a colleague to buy a box of eating, there is a sea bream, a saucer, and the savory taste @ 螽斯 -:? there is a little envious","['tear', '海天', '乡', '特曼', '惜', 'fujian', '李子', 'harp', 'shanghai', 'eat', 'expensive', 'gourmet', 'fujian', 'country', '煌', '公', '透', '蓝', '瓶子', 'fuqing', 'sea', 'breaker', 'absolute', 'saw', 'colleague', 'buy', 'box', 'eat', 'sea', 'bream', 'saucer', 'savory', 'taste', '螽斯', 'little', 'envious']"
169,6450,"The Japanese dog food is too much, come to the dog's dog food [二] # 厦 约 拍 [超 话] ## 厦 旅游游 [[超 话] # ???",0,0.0,0,0,0.0,0.0,0,0.0,0,0,0.0,0.0,0.0,0.0,0,0,0.0,0,0,0.0,0,0.0,0,0,0,0,0.0,0.0,0.0,0,0,0,0,0.0,0,0.0,0,0.0,0,0,0,0.0,0,0,0.0,0,0.0,0,0,0,0,0.0,0,0,0.0,0,0,0.0,0,0.0,0,0,0,0.0,0.0,0.0,0.0,0,0,0,0,0,0,0,0.0,0.0,0.0,0,0,0.0,0.0,0,0,0.0,0,0,0.0,0.0,0,0,0,0,0.0,0.0,0.0,0,0,0,0.0,0,0,0,0.0,0.0,0.0,0.0,0.0,0,0.0,0,0.0,0,0,0,0,0,0.0,0,0,0,0.0,0,0,0,0.0,0.0,0,0,0,0,0,0,0,0.0,0,0.0,100,0,0.0,0,0,0,0.0,0,0,0,0,0,0.0,0.0,0,0,0.0,0.0,0.0,0.0,0,0,0,0,0,0.0,0,0,0.0,0.0,0,0,0,0,0.0,0,0.0,0.0,0,0,0.0,0,0,0.0,0,0.0,0,0,0.0,0.0,0.0,0,0,0,0,0,0.0,0,0,0,0,0.0,0.0,0.0,0.0,0,0,0,0,0,0.0,0,0,0.0,0,0,0,0,0.0,0,0.0,0.0,0.0,0,0.0,0.0,0.0,0.0,0,0,100,0,100.0,0.0,0.0,0,0.0,0.0,0.0,0,0,0.0,0,0,0,0,0.0,0.0,0.0,0,0,0,0,0.0,0,0,0,0,0,0,0,0.0,0.0,0.0,0.0,0,0,0.0,0,0.0,0.0,0.0,0.0,0,0,0,0.0,0,0,0.0,0,0,0.0,0.0,0,0.0,0.0,0.0,0.0,0,0,0.0,0,0,0,0,0.0,0.0,0.0,0.0,0,0,0,0,0,0,0,0,0.0,0,0.0,0.0,0.0,0.0,0.0,0.0,0,0.0,0,0,0,0,0,0.0,0,0.0,0.0,0.0,0,0.0,0,0.0,0,0,0,0,0,0,0,0.0,0.0,0,0.0,0,0,0.0,0,0,0,0,0,0,0,0,0.0,0.0,0,0,0.0,0,0.0,0,0,0,0.0,0.0,0,0,0,0,0,0.0,0,0.0,0.0,0.0,0.0,30000,http://weibo.com/1690573652/K8Jhg3f2e,CN,CN,"the japanese dog food is too much, come to the dog's dog food [二] # 厦 约 拍 [超 话] ## 厦 旅游游 [[超 话] # ???","['japanese', 'dog', 'food', 'much', 'dog', 'dog', 'food', '约', '拍']"
170,6457,"I hope some people know me, in the evening, Shandong # 厦 约 拍 ## 厦 旅游游 # # http: t.cn/r5dgyvl ???",0,0.0,0,0,0.0,0.0,0,0.0,0,0,0.0,0.0,0.0,0.0,0,0,0.0,0,0,0.0,0,0.0,0,0,0,0,0.0,0.0,0.0,0,0,0,0,0.0,0,0.0,0,0.0,0,0,0,0.0,0,0,0.0,0,0.0,0,0,0,0,0.0,0,0,0.0,0,0,0.0,0,0.0,0,0,0,0.0,0.0,0.0,0.0,0,0,0,0,0,0,0,0.0,0.0,0.0,0,0,0.0,0.0,0,0,0.0,0,0,0.0,0.0,0,0,0,0,0.0,0.0,0.0,0,0,0,0.0,0,0,0,0.0,0.0,0.0,0.0,0.0,0,0.0,0,0.0,0,0,0,0,0,0.0,0,0,0,0.0,0,0,0,0.0,0.0,0,0,0,0,0,0,0,0.0,0,0.0,100,0,0.0,0,0,0,0.0,0,0,0,0,0,0.0,0.0,0,0,0.0,0.0,0.0,0.0,0,0,0,0,0,0.0,0,0,0.0,0.0,0,0,0,0,0.0,0,0.0,0.0,0,0,0.0,0,0,0.0,0,0.0,0,0,0.0,0.0,0.0,0,0,0,0,0,0.0,0,0,0,0,0.0,0.0,0.0,0.0,0,0,0,0,0,0.0,0,0,0.0,0,0,0,0,0.0,0,0.0,0.0,0.0,0,0.0,0.0,0.0,0.0,0,0,0,0,0.0,0.0,0.0,0,0.0,0.0,0.0,0,0,0.0,0,0,0,0,0.0,0.0,0.0,0,0,0,0,0.0,0,0,0,0,0,0,0,0.0,0.0,0.0,0.0,0,0,0.0,0,0.0,0.0,0.0,0.0,0,0,0,0.0,0,0,0.0,0,0,0.0,0.0,0,0.0,0.0,0.0,0.0,0,0,0.0,0,0,0,0,0.0,0.0,0.0,0.0,0,0,0,0,0,0,0,0,0.0,0,0.0,0.0,0.0,0.0,0.0,0.0,0,0.0,0,0,0,0,0,0.0,0,0.0,0.0,0.0,0,0.0,0,0.0,0,0,0,0,0,0,0,0.0,0.0,0,0.0,0,0,0.0,0,0,0,0,0,0,0,0,0.0,0.0,0,0,0.0,0,0.0,0,0,0,0.0,0.0,0,0,0,0,0,0.0,0,0.0,0.0,0.0,0.0,10000,http://weibo.com/2250617911/KdJOPtgSz,CN,CN,"i hope some people know me, in the evening, shandong # 厦 约 拍 ## 厦 旅游游 # # http: t.cn/r5dgyvl ???","['people', 'shandong', '约', '拍', 'r5dgyvl']"
171,6495,"[Changsha Travel Guide] | Changsha travel from Changsha, go to Fenghuang Ancient City, go to Zhangjiajie Tourism ... How to get along the route?
 Hunan attractions are recommended and route arrangements, go to Phoenix Ancient City Zhangjiajie 3 Day 2 nights, etc. ~ full of dry goods, don't miss [heart] about friends, go together in Changsha's most beautiful season, go to Changsha's most beautiful scenery!
 ????",0,0.0,0,0,0.0,0.0,0,0.0,0,0,0.0,0.0,0.0,0.0,0,0,0.0,0,0,0.0,0,0.0,0,0,0,0,0.0,0.0,0.0,0,0,0,0,0.0,0,0.0,0,0.0,0,0,0,0.0,0,0,0.0,0,0.0,0,0,0,0,0.0,0,0,0.0,0,0,0.0,0,0.0,0,0,0,0.0,0.0,0.0,0.0,0,0,0,0,0,0,0,0.0,0.0,0.0,0,0,0.0,0.0,0,0,0.0,0,0,0.0,0.0,0,100,0,0,0.0,0.0,0.0,0,0,0,0.0,0,0,0,0.0,0.0,0.0,0.0,0.0,0,0.0,0,0.0,0,0,0,0,0,0.0,0,0,0,0.0,0,0,0,0.0,0.0,0,0,0,0,0,0,0,0.0,0,0.0,100,0,0.0,0,0,0,0.0,0,0,0,0,0,0.0,0.0,0,0,0.0,0.0,0.0,0.0,0,0,0,0,0,0.0,0,0,0.0,0.0,0,0,0,0,0.0,0,0.0,0.0,0,0,0.0,0,0,0.0,0,0.0,0,0,0.0,0.0,0.0,0,0,0,0,0,0.0,0,0,0,0,0.0,0.0,0.0,0.0,0,0,0,0,0,0.0,0,0,0.0,0,0,0,0,0.0,0,0.0,0.0,0.0,0,0.0,0.0,0.0,0.0,0,0,0,0,0.0,0.0,0.0,0,0.0,0.0,0.0,0,0,0.0,0,0,0,0,0.0,0.0,0.0,0,0,0,0,0.0,0,0,0,0,0,0,0,0.0,0.0,0.0,0.0,0,0,0.0,0,0.0,0.0,0.0,0.0,0,0,0,0.0,0,0,0.0,0,0,0.0,0.0,0,0.0,0.0,0.0,0.0,0,0,0.0,0,0,0,0,0.0,0.0,0.0,0.0,0,0,0,0,0,0,0,0,0.0,0,0.0,0.0,0.0,0.0,0.0,0.0,0,0.0,0,0,0,0,0,0.0,0,0.0,0.0,0.0,0,0.0,0,0.0,0,0,0,0,0,0,0,0.0,0.0,0,0.0,0,0,0.0,100,0,0,0,0,0,0,0,0.0,0.0,0,0,0.0,0,0.0,0,0,0,0.0,0.0,0,0,0,0,0,0.0,0,0.0,0.0,0.0,0.0,30000,http://weibo.com/2453884657/Kc9sO8kMv,CN,CN,"[changsha travel guide] | changsha travel from changsha, go to fenghuang ancient city, go to zhangjiajie tourism ... how to get along the route?
 hunan attractions are recommended and route arrangements, go to phoenix ancient city zhangjiajie 3 day 2 nights, etc. ~ full of dry goods, don't miss [heart] about friends, go together in changsha's most beautiful season, go to changsha's most beautiful scenery!
 ????","['changsha', 'travel', 'guide', 'changsha', 'travel', 'changsha', 'fenghuang', 'ancient', 'city', 'zhangjiajie', 'tourism', 'route', 'hunan', 'attractions', 'recommend', 'route', 'arrangements', 'phoenix', 'ancient', 'city', 'zhangjiajie', '3', 'day', '2', 'nights', 'full', 'dry', 'goods', 'miss', 'heart', 'friends', 'together', 'changshas', 'beautiful', 'season', 'changshas', 'beautiful', 'scenery']"
172,6538,"""Chengdu Tourism Raiders"" to play cards Chengdu food can be said to be a super comprehensive and specific one!",0,0.0,0,0,0.0,0.0,0,0.0,0,0,0.0,0.0,0.0,0.0,0,0,0.0,0,0,0.0,0,0.0,0,0,0,0,0.0,0.0,0.0,0,0,0,0,0.0,0,0.0,0,0.0,0,0,0,0.0,0,0,0.0,0,0.0,0,0,0,0,0.0,0,0,0.0,0,0,0.0,0,0.0,0,0,0,0.0,0.0,0.0,0.0,0,0,0,0,0,0,0,0.0,0.0,0.0,0,0,0.0,0.0,0,0,0.0,0,0,0.0,0.0,0,0,0,0,0.0,0.0,0.0,0,0,0,0.0,0,0,0,0.0,0.0,0.0,0.0,0.0,0,0.0,0,0.0,0,0,0,0,0,0.0,0,0,0,0.0,0,0,0,0.0,0.0,0,0,0,0,0,0,0,0.0,0,0.0,100,0,0.0,0,0,0,0.0,0,0,0,0,0,0.0,0.0,0,0,0.0,0.0,0.0,0.0,0,0,0,0,100,0.0,0,0,0.0,0.0,0,0,0,0,0.0,0,0.0,0.0,0,0,0.0,0,0,0.0,0,0.0,0,0,0.0,0.0,0.0,0,0,0,0,0,0.0,0,0,0,0,0.0,0.0,0.0,0.0,0,0,0,0,0,0.0,0,0,0.0,0,0,0,0,0.0,0,0.0,0.0,0.0,0,0.0,0.0,0.0,0.0,0,0,0,0,0.0,0.0,0.0,0,0.0,0.0,0.0,0,0,0.0,0,0,0,0,0.0,0.0,0.0,0,0,0,0,0.0,0,0,0,0,0,0,0,0.0,0.0,0.0,0.0,0,0,0.0,0,0.0,0.0,0.0,0.0,0,0,0,0.0,0,0,0.0,0,0,0.0,0.0,0,0.0,0.0,0.0,0.0,0,0,0.0,0,0,0,0,0.0,0.0,0.0,0.0,0,0,0,0,0,0,0,0,0.0,0,0.0,0.0,0.0,0.0,0.0,0.0,0,0.0,0,0,0,0,0,0.0,0,0.0,0.0,0.0,0,0.0,0,0.0,0,0,0,0,0,0,0,0.0,0.0,0,0.0,0,0,0.0,0,0,0,0,0,0,0,0,0.0,0.0,0,0,0.0,0,0.0,0,0,0,0.0,0.0,0,0,0,0,0,0.0,0,0.0,0.0,0.0,0.0,20000,http://weibo.com/6266706335/JDnD0252U,CN,CN,"""chengdu tourism raiders"" to play cards chengdu food can be said to be a super comprehensive and specific one!","['chengdu', 'tourism', 'play', 'card', 'chengdu', 'food', 'super', 'comprehensive', 'specific', 'one']"
173,6572,"# Take the high-speed rail tour water rhyme, Jiangsu # is also the ""May 1"" of the people who want to go to the popular scenic spot, and the ""May 1"", the ""May 1"", which is also exciting, 萌 宠, parent-child tour, reading history so rich holiday activities don't hurry
 Look ~ (Source: Wen Shi Changzhou)???",0,0.0,0,0,0.0,0.0,0,0.0,0,0,0.0,0.0,0.0,0.0,0,0,0.0,0,0,0.0,0,0.0,0,0,0,0,0.0,0.0,0.0,0,0,0,0,0.0,0,0.0,0,0.0,0,0,0,0.0,0,0,0.0,0,0.0,0,0,0,0,0.0,0,0,0.0,0,0,0.0,0,0.0,0,0,0,0.0,0.0,0.0,0.0,0,0,0,0,0,0,0,0.0,0.0,0.0,0,0,0.0,0.0,0,0,0.0,0,0,0.0,0.0,0,0,0,0,0.0,0.0,0.0,0,0,0,0.0,0,0,0,0.0,0.0,0.0,0.0,0.0,0,0.0,0,0.0,0,0,0,0,0,0.0,0,0,0,0.0,0,0,0,0.0,0.0,0,0,0,0,0,0,0,0.0,0,0.0,100,0,0.0,0,0,0,0.0,0,0,0,0,0,0.0,0.0,0,0,0.0,0.0,0.0,0.0,0,0,0,0,0,0.0,0,0,0.0,0.0,0,0,0,0,0.0,0,0.0,0.0,0,0,0.0,0,0,0.0,0,0.0,0,0,0.0,0.0,0.0,0,0,0,0,0,0.0,0,0,0,0,0.0,0.0,0.0,0.0,0,0,0,0,0,0.0,0,0,0.0,0,0,0,0,0.0,0,0.0,0.0,0.0,0,0.0,0.0,0.0,0.0,0,0,0,0,0.0,0.0,0.0,0,0.0,0.0,0.0,0,0,0.0,0,0,0,0,0.0,0.0,0.0,0,0,0,0,0.0,0,0,0,0,0,0,0,0.0,0.0,0.0,0.0,0,0,0.0,0,0.0,0.0,0.0,0.0,0,0,0,0.0,0,0,0.0,0,0,0.0,0.0,0,0.0,0.0,0.0,0.0,0,0,0.0,0,0,0,0,0.0,0.0,0.0,0.0,0,0,0,0,0,0,0,0,0.0,0,0.0,0.0,0.0,0.0,0.0,0.0,0,0.0,0,0,0,0,0,0.0,0,0.0,0.0,0.0,0,0.0,0,0.0,0,0,0,0,0,0,0,0.0,0.0,0,0.0,0,0,0.0,100,0,0,0,0,0,0,0,0.0,0.0,0,0,0.0,0,0.0,0,0,0,0.0,0.0,0,0,0,0,0,0.0,0,0.0,0.0,0.0,0.0,20000,http://weibo.com/2155166337/Kdh9EEsIB,CN,CN,"# take the high-speed rail tour water rhyme, jiangsu # is also the ""may 1"" of the people who want to go to the popular scenic spot, and the ""may 1"", the ""may 1"", which is also exciting, 萌 宠, parent-child tour, reading history so rich holiday activities don't hurry
 look ~ (source: wen shi changzhou)???","['high', 'speed', 'rail', 'tour', 'water', 'rhyme', 'jiangsu', 'may', '1', 'people', 'popular', 'scenic', 'spot', 'may', '1', 'may', '1', 'excite', '萌', '宠', 'parent', 'child', 'tour', 'read', 'history', 'rich', 'holiday', 'activities', 'hurry', 'source', 'wen', 'shi', 'changzhou']"
174,6654,"Looking at Dunhuang Mogao Grottoes is equivalent to seeing ancient civilizations in the world.
 This is never spoken.
 Dunhuang Mogao Grottoes are located 25 kilometers southeast of Dunhuang City, West End of Hexi Corridor. It is covered in Shandong.
 #travelling guideline#",0,0.0,0,0,0.0,0.0,0,0.0,0,0,0.0,0.0,0.0,0.0,0,0,0.0,0,0,0.0,0,0.0,0,0,0,0,0.0,0.0,0.0,0,0,0,0,0.0,0,0.0,0,0.0,0,0,0,0.0,0,0,0.0,0,0.0,0,0,0,0,0.0,0,0,0.0,0,0,0.0,0,0.0,0,0,0,0.0,0.0,0.0,0.0,0,0,0,0,0,0,0,0.0,0.0,0.0,0,0,0.0,0.0,0,0,0.0,0,0,0.0,0.0,0,0,0,0,0.0,0.0,0.0,0,0,0,0.0,0,0,0,0.0,0.0,0.0,0.0,0.0,0,0.0,0,0.0,0,0,0,0,0,0.0,0,0,0,0.0,0,0,0,0.0,0.0,0,0,0,0,0,0,0,0.0,0,0.0,100,0,0.0,0,0,0,0.0,0,0,0,0,0,0.0,0.0,0,0,0.0,0.0,0.0,0.0,0,0,0,0,0,0.0,0,0,0.0,0.0,0,0,0,0,0.0,0,0.0,0.0,0,0,0.0,0,0,0.0,0,0.0,0,0,0.0,0.0,0.0,0,0,0,0,0,0.0,0,0,0,0,0.0,0.0,0.0,0.0,100,0,0,0,0,0.0,0,0,0.0,0,0,0,0,0.0,0,0.0,0.0,0.0,0,0.0,0.0,0.0,0.0,0,0,0,0,0.0,0.0,0.0,0,0.0,0.0,0.0,0,0,0.0,0,0,0,0,0.0,0.0,0.0,0,0,0,0,0.0,0,0,0,0,0,0,0,0.0,0.0,0.0,0.0,0,0,0.0,0,0.0,0.0,0.0,0.0,0,0,0,0.0,0,0,0.0,0,0,0.0,0.0,0,0.0,0.0,0.0,0.0,0,0,0.0,0,0,0,0,0.0,0.0,0.0,0.0,0,0,0,0,0,0,0,0,0.0,0,0.0,0.0,0.0,0.0,0.0,0.0,0,0.0,0,0,0,0,0,0.0,0,0.0,0.0,0.0,0,0.0,0,0.0,0,0,0,0,0,0,0,0.0,0.0,0,0.0,0,0,0.0,100,0,0,0,0,0,0,0,0.0,0.0,0,0,0.0,0,0.0,0,0,0,0.0,0.0,0,0,0,0,0,0.0,0,0.0,0.0,0.0,0.0,30000,http://weibo.com/1785350585/K0k6GpkzZ,CN,CN,"looking at dunhuang mogao grottoes is equivalent to seeing ancient civilizations in the world.
 this is never spoken.
 dunhuang mogao grottoes are located 25 kilometers southeast of dunhuang city, west end of hexi corridor. it is covered in shandong.
 #travelling guideline#","['dunhuang', 'mogao', 'grottoes', 'equivalent', 'see', 'ancient', 'civilizations', 'world', 'speak', 'dunhuang', 'mogao', 'grottoes', 'locate', '25', 'kilometers', 'southeast', 'dunhuang', 'city', 'west', 'end', 'hexi', 'corridor', 'cover', 'shandong', 'travel', 'guideline']"
175,6672,"The most fun Jiangsu travel Raiders is coming!
 [With Weibo to travel] Amusement park, ancient town, garden ... one should be full!
 Bring this Raiders, play Jiangsu, [play call] ???? @ 江苏 微 旅游 ????",0,0.0,0,0,0.0,0.0,0,0.0,0,0,0.0,0.0,0.0,0.0,0,0,0.0,0,0,0.0,0,0.0,0,0,0,0,0.0,0.0,0.0,0,0,0,0,0.0,0,0.0,0,0.0,0,0,0,0.0,0,0,0.0,0,0.0,0,0,0,0,0.0,0,0,0.0,0,0,0.0,0,0.0,0,0,0,0.0,0.0,0.0,0.0,0,0,0,0,0,0,0,0.0,0.0,0.0,0,0,0.0,0.0,0,0,0.0,0,0,0.0,0.0,0,0,50,0,0.0,0.0,0.0,0,0,0,0.0,0,0,0,0.0,0.0,0.0,0.0,0.0,0,0.0,0,0.0,0,0,0,0,0,0.0,0,0,0,0.0,0,0,0,0.0,0.0,0,0,0,0,0,0,0,0.0,0,0.0,200,0,0.0,0,0,0,0.0,0,0,0,0,0,0.0,0.0,0,0,0.0,0.0,0.0,0.0,0,0,0,0,0,0.0,0,0,0.0,0.0,0,0,0,0,0.0,0,0.0,0.0,0,0,0.0,0,0,0.0,0,0.0,0,0,0.0,0.0,0.0,0,0,0,0,0,0.0,0,0,0,0,0.0,0.0,0.0,0.0,0,0,0,0,0,0.0,0,0,0.0,0,0,0,0,0.0,0,0.0,0.0,0.0,0,0.0,0.0,0.0,0.0,0,0,0,0,0.0,0.0,0.0,0,0.0,0.0,0.0,0,0,0.0,0,0,0,0,0.0,0.0,0.0,0,0,0,0,0.0,0,0,0,0,0,0,0,0.0,0.0,0.0,0.0,0,0,0.0,0,0.0,0.0,0.0,0.0,0,0,0,0.0,0,0,0.0,0,0,0.0,0.0,0,0.0,0.0,0.0,0.0,0,0,0.0,0,0,0,0,0.0,0.0,0.0,0.0,0,0,0,0,0,0,0,0,0.0,0,0.0,0.0,0.0,0.0,0.0,0.0,0,0.0,0,0,0,0,0,0.0,0,0.0,0.0,0.0,0,0.0,0,0.0,0,0,0,0,0,0,0,0.0,0.0,0,0.0,0,0,0.0,0,0,0,0,50,0,0,50,0.0,0.0,0,50,0.0,0,0.0,0,0,0,0.0,0.0,0,0,0,0,0,0.0,0,0.0,0.0,0.0,0.0,30000,http://weibo.com/2674743721/Kdumi9WV6,CN,CN,"the most fun jiangsu travel raiders is coming!
 [with weibo to travel] amusement park, ancient town, garden ... one should be full!
 bring this raiders, play jiangsu, [play call] ???? @ 江苏 微 旅游 ????","['fun', 'jiangsu', 'travel', 'weibo', 'travel', 'amusement', 'park', 'ancient', 'town', 'garden', 'one', 'full', 'bring', 'play', 'jiangsu', 'play', 'call', '江苏']"
176,6733,"Who can think of a long night, I am doing Nanjing Travel Guide?
 I want to Wutong Tree wants Xianlin Lake, Da Chengqiying New Street, Duck Soup Bags, Biscuits, Biscuits, Egg Pizza, Pastry Bullfrog Dragonfish, and 70, 97, and Line 2, 呜呜呜
 Sisters who have not met half a year [tears]???",0,0.0,0,0,0.0,0.0,0,0.0,0,0,0.0,0.0,0.0,0.0,0,0,0.0,0,0,0.0,0,0.0,0,0,0,0,0.0,0.0,0.0,0,0,0,0,0.0,0,0.0,0,0.0,0,0,0,0.0,0,0,0.0,0,0.0,0,0,0,0,0.0,0,0,0.0,0,0,0.0,0,0.0,0,0,0,0.0,0.0,0.0,0.0,0,0,0,0,0,0,0,0.0,0.0,0.0,0,0,0.0,0.0,0,0,0.0,0,0,0.0,0.0,0,0,0,0,0.0,0.0,0.0,0,0,0,0.0,0,0,0,0.0,0.0,0.0,0.0,0.0,0,0.0,0,0.0,0,0,0,0,0,0.0,0,0,0,0.0,0,0,0,0.0,0.0,0,0,0,0,0,100,0,0.0,0,0.0,100,0,0.0,0,0,0,0.0,0,0,0,0,0,0.0,0.0,0,0,0.0,0.0,0.0,0.0,0,0,0,0,0,0.0,0,0,0.0,0.0,0,0,0,0,0.0,0,0.0,0.0,0,0,0.0,0,0,0.0,0,0.0,0,0,0.0,0.0,0.0,0,0,0,0,0,0.0,0,0,0,0,0.0,0.0,0.0,0.0,0,0,0,0,0,0.0,0,0,0.0,0,0,0,0,0.0,0,0.0,0.0,0.0,0,0.0,0.0,0.0,0.0,0,0,0,0,0.0,0.0,0.0,0,0.0,0.0,0.0,0,0,0.0,0,0,0,0,0.0,0.0,0.0,0,0,0,0,0.0,0,0,0,0,0,0,0,0.0,0.0,0.0,0.0,0,0,0.0,0,0.0,0.0,0.0,0.0,0,0,0,0.0,0,0,0.0,0,0,0.0,0.0,0,0.0,0.0,0.0,0.0,0,0,0.0,0,0,0,0,0.0,0.0,0.0,0.0,0,0,0,0,0,0,0,0,0.0,0,0.0,0.0,0.0,0.0,0.0,0.0,0,0.0,0,0,0,0,0,0.0,0,0.0,0.0,0.0,0,0.0,0,0.0,0,0,0,0,0,0,0,0.0,0.0,0,0.0,0,0,0.0,0,0,0,0,0,0,0,0,0.0,0.0,0,0,0.0,0,0.0,0,0,0,0.0,0.0,0,0,0,0,0,0.0,0,0.0,0.0,0.0,0.0,20000,http://weibo.com/2791891517/KoiLu5Skf,CN,CN,"who can think of a long night, i am doing nanjing travel guide?
 i want to wutong tree wants xianlin lake, da chengqiying new street, duck soup bags, biscuits, biscuits, egg pizza, pastry bullfrog dragonfish, and 70, 97, and line 2, 呜呜呜
 sisters who have not met half a year [tears]???","['long', 'night', 'nanjing', 'travel', 'guide', 'wutong', 'tree', 'xianlin', 'lake', 'da', 'chengqiying', 'new', 'street', 'duck', 'soup', 'bag', 'biscuits', 'biscuits', 'egg', 'pizza', 'pastry', 'bullfrog', 'dragonfish', '70', '97', 'line', '2', '呜呜呜', 'sisters', 'meet', 'half', 'tear']"
177,6744,"Although it belongs to home seafood, it is still very shocked in the box! [] @ 不 想 当 病: 发 鸿 看 看: Your blood loss @ HARPS: I don't have to go to Shanghai to eat a precious food, I will
 Go to Fujian into the country!
 @ 煌 公: @ @ 透 蓝 瓶子: Fuqing sea breaker is really absolute!
 I saw a colleague to buy a box of eating, there is a sea bream, a saucer, and the savory taste @ 螽斯 -:? There is a little envious",0,0.0,0,0,0.0,0.0,0,0.0,0,0,0.0,0.0,0.0,0.0,0,0,0.0,0,0,0.0,0,0.0,0,0,0,0,0.0,0.0,0.0,0,0,0,0,0.0,0,0.0,0,0.0,0,0,0,0.0,0,0,0.0,0,0.0,0,0,0,0,0.0,0,0,0.0,0,0,0.0,0,0.0,0,0,0,0.0,0.0,0.0,0.0,0,0,0,0,0,0,0,0.0,0.0,0.0,0,0,0.0,0.0,0,0,0.0,0,0,0.0,0.0,0,0,0,0,0.0,0.0,0.0,0,0,0,0.0,0,0,0,0.0,0.0,0.0,0.0,0.0,0,0.0,0,0.0,0,0,0,0,0,0.0,0,0,0,0.0,0,0,0,0.0,0.0,0,0,0,0,0,0,0,0.0,0,0.0,100,0,0.0,0,0,0,0.0,0,0,0,0,0,0.0,0.0,0,0,0.0,0.0,0.0,0.0,0,0,0,0,0,0.0,0,0,0.0,0.0,0,0,0,0,0.0,0,0.0,0.0,0,0,0.0,0,0,0.0,0,0.0,0,0,0.0,0.0,0.0,0,0,0,0,0,0.0,0,0,0,0,0.0,0.0,0.0,0.0,0,0,0,0,0,0.0,0,0,0.0,0,0,0,0,0.0,0,0.0,0.0,0.0,0,0.0,0.0,0.0,0.0,0,0,0,0,0.0,0.0,0.0,0,0.0,0.0,0.0,0,0,0.0,0,0,0,0,0.0,0.0,0.0,0,0,0,0,0.0,0,0,0,0,0,0,0,0.0,0.0,0.0,0.0,0,0,0.0,0,0.0,0.0,0.0,0.0,0,0,0,0.0,0,0,0.0,0,0,0.0,0.0,0,0.0,0.0,0.0,0.0,0,0,0.0,0,0,0,0,0.0,0.0,0.0,0.0,0,0,0,0,0,0,0,0,0.0,0,0.0,0.0,0.0,0.0,0.0,0.0,0,0.0,0,0,0,0,0,0.0,0,0.0,0.0,0.0,0,0.0,0,0.0,0,0,0,0,0,0,0,0.0,0.0,0,0.0,0,0,0.0,0,0,0,0,0,0,0,0,0.0,0.0,0,0,0.0,0,0.0,0,0,0,0.0,0.0,0,0,0,0,0,0.0,0,0.0,0.0,0.0,0.0,10000,http://weibo.com/2667197793/KhGNw7gbe,CN,CN,"although it belongs to home seafood, it is still very shocked in the box! [] @ 不 想 当 病: 发 鸿 看 看: your blood loss @ harps: i don't have to go to shanghai to eat a precious food, i will
 go to fujian into the country!
 @ 煌 公: @ @ 透 蓝 瓶子: fuqing sea breaker is really absolute!
 i saw a colleague to buy a box of eating, there is a sea bream, a saucer, and the savory taste @ 螽斯 -:? there is a little envious","['belong', 'home', 'seafood', 'shock', 'box', '想', '当', '病', '鸿', '看', '看', 'blood', 'loss', 'harp', 'shanghai', 'eat', 'precious', 'food', 'fujian', 'country', '煌', '公', '透', '蓝', '瓶子', 'fuqing', 'sea', 'breaker', 'absolute', 'saw', 'colleague', 'buy', 'box', 'eat', 'sea', 'bream', 'saucer', 'savory', 'taste', '螽斯', 'little', 'envious']"
178,6750,"# 尔滨 Travel Guide # Harbin three days and two nights travel Raiders write ???? Winter should go to Harbin ???? P1 written in front? Travel information? P2 equipment list? Notes? P3
 Cheap accommodation? P4 / 6/7 three days trip? Sightsee recommendation? P8 / 9 Harbin food recommendation Author: here???",0,0.0,0,0,0.0,0.0,0,0.0,0,0,0.0,0.0,0.0,0.0,0,0,0.0,0,0,0.0,0,0.0,0,0,0,0,0.0,0.0,0.0,0,0,0,0,0.0,0,0.0,0,0.0,0,0,0,0.0,0,0,0.0,0,0.0,0,0,0,0,0.0,0,0,0.0,0,0,0.0,0,0.0,0,0,0,0.0,0.0,0.0,0.0,0,0,100,0,0,0,0,0.0,0.0,0.0,0,0,0.0,0.0,0,0,0.0,0,0,0.0,0.0,0,0,0,0,0.0,0.0,0.0,0,0,0,0.0,0,0,0,0.0,0.0,0.0,0.0,0.0,0,0.0,0,0.0,0,0,0,0,0,0.0,0,0,0,0.0,0,0,0,0.0,0.0,0,0,0,0,0,0,0,0.0,0,0.0,100,0,0.0,0,0,0,0.0,0,0,0,0,0,0.0,0.0,0,0,0.0,0.0,0.0,0.0,0,0,0,0,0,0.0,0,0,0.0,0.0,0,0,0,0,0.0,0,0.0,0.0,0,0,0.0,0,0,0.0,0,0.0,0,0,0.0,0.0,0.0,0,0,0,0,0,0.0,0,0,0,0,0.0,0.0,0.0,0.0,0,0,0,0,0,0.0,0,0,0.0,0,0,0,0,0.0,0,0.0,0.0,0.0,0,0.0,0.0,0.0,0.0,0,0,0,0,0.0,0.0,0.0,0,0.0,0.0,0.0,0,0,0.0,0,0,0,0,0.0,0.0,0.0,0,0,0,0,0.0,0,0,0,0,0,0,0,0.0,0.0,0.0,0.0,0,0,0.0,0,0.0,0.0,0.0,0.0,0,0,0,0.0,0,0,0.0,0,0,0.0,0.0,0,0.0,0.0,0.0,0.0,0,0,0.0,0,0,0,0,0.0,0.0,0.0,0.0,0,0,0,0,0,0,0,0,0.0,0,0.0,0.0,0.0,0.0,0.0,0.0,0,0.0,0,0,0,0,0,0.0,0,0.0,0.0,0.0,0,0.0,0,0.0,0,0,0,0,0,0,0,0.0,0.0,0,0.0,0,0,0.0,0,0,0,0,0,0,0,100,0.0,0.0,0,0,0.0,0,0.0,0,0,0,0.0,0.0,0,0,0,0,0,0.0,0,0.0,0.0,0.0,0.0,30000,http://weibo.com/2526523984/K2Cqv6ep6,CN,CN,"# 尔滨 travel guide # harbin three days and two nights travel raiders write ???? winter should go to harbin ???? p1 written in front? travel information? p2 equipment list? notes? p3
 cheap accommodation? p4 / 6/7 three days trip? sightsee recommendation? p8 / 9 harbin food recommendation author: here???","['尔滨', 'travel', 'guide', 'harbin', 'three', 'days', 'two', 'nights', 'travel', 'write', 'winter', 'harbin', 'p1', 'write', 'front', 'travel', 'information', 'p2', 'equipment', 'note', 'p3', 'cheap', 'accommodation', 'p4', '6', '7', 'three', 'days', 'trip', 'sightsee', 'recommendation', 'p8', '9', 'harbin', 'food', 'recommendation', 'author']"
179,6796,"[Weiwu] Qinghai tea Kazi Lake sky [give you a careful heart] Beauty is like the world [Mickey Pie] Tian is part of the lake, the lake is a heavenly supplement [breeze] Looking around, like illusion [mutual powder] into
 Dream, unlimited delusional tourism local chartered Pony @ 微 博 旅游 旅游 @ 新浪 旅游游 # 青海 旅行 ## 青海 旅游 略 # http: t.cn/a6cnmeaf ???",0,0.0,0,0,0.0,0.0,0,0.0,0,0,0.0,0.0,0.0,0.0,0,0,0.0,0,0,0.0,0,0.0,0,0,0,0,0.0,0.0,0.0,0,0,0,0,0.0,0,0.0,0,0.0,0,0,0,0.0,0,0,0.0,0,0.0,0,0,0,0,0.0,0,0,0.0,0,0,0.0,0,0.0,0,0,0,0.0,0.0,0.0,0.0,0,0,0,0,0,0,0,0.0,0.0,0.0,0,0,0.0,0.0,0,0,0.0,0,0,0.0,0.0,0,0,0,0,0.0,0.0,0.0,0,0,0,0.0,0,0,0,0.0,0.0,0.0,0.0,0.0,0,0.0,0,0.0,0,0,0,0,0,0.0,0,0,0,0.0,0,0,0,0.0,0.0,0,0,0,0,0,0,0,0.0,0,0.0,100,0,0.0,0,0,0,0.0,0,0,0,0,0,0.0,0.0,0,0,0.0,0.0,0.0,0.0,0,0,0,0,0,0.0,0,0,0.0,0.0,0,0,0,0,0.0,0,0.0,0.0,0,0,0.0,0,0,0.0,0,0.0,0,0,0.0,0.0,0.0,0,0,0,0,0,0.0,0,0,0,0,0.0,0.0,0.0,0.0,0,0,0,0,0,0.0,0,0,0.0,0,0,0,0,0.0,0,0.0,0.0,0.0,0,0.0,0.0,0.0,0.0,0,0,0,100,0.0,0.0,0.0,0,0.0,0.0,0.0,0,0,0.0,0,0,0,0,0.0,0.0,0.0,0,0,0,0,0.0,0,0,0,0,0,0,0,0.0,0.0,0.0,0.0,0,0,0.0,0,0.0,0.0,0.0,0.0,0,0,0,0.0,0,0,0.0,0,0,0.0,0.0,0,0.0,0.0,0.0,0.0,0,0,0.0,0,0,0,0,0.0,0.0,0.0,0.0,0,0,0,0,0,0,0,0,0.0,0,0.0,0.0,0.0,0.0,0.0,0.0,0,0.0,0,0,0,0,0,0.0,0,0.0,0.0,0.0,0,0.0,0,0.0,0,0,0,0,0,0,0,0.0,0.0,0,0.0,0,0,0.0,100,0,0,0,0,0,0,0,0.0,0.0,0,0,0.0,0,0.0,0,0,0,0.0,0.0,0,0,0,0,0,0.0,0,0.0,0.0,0.0,0.0,30000,http://weibo.com/5941739766/KbTRowZz5,CN,CN,"[weiwu] qinghai tea kazi lake sky [give you a careful heart] beauty is like the world [mickey pie] tian is part of the lake, the lake is a heavenly supplement [breeze] looking around, like illusion [mutual powder] into
 dream, unlimited delusional tourism local chartered pony @ 微 博 旅游 旅游 @ 新浪 旅游游 # 青海 旅行 ## 青海 旅游 略 # http: t.cn/a6cnmeaf ???","['weiwu', 'qinghai', 'tea', 'kazi', 'lake', 'sky', 'careful', 'heart', 'beauty', 'world', 'mickey', 'pie', 'tian', 'part', 'lake', 'lake', 'heavenly', 'supplement', 'breeze', 'illusion', 'mutual', 'powder', 'dream', 'unlimited', 'delusional', 'tourism', 'local', 'charter', 'pony', '新浪', '旅行', 'a6cnmeaf']"
